Song Title,Lyrics
Lonely One,"Honey, how's that drink goin' down <br> Seems a little still for 2 PM <br> Holler if you need anything <br> I've got an ear to lend <br> I'll be right here cuttin' lines <br> Countin' cash and stockin' beers <br> I've got an idea what's on your mind <br> So in the meantime, think on this <br> I've seen girls like you in here before <br> Watched broken hearts break <br> Though that door a time or two <br> And I'll bet he packed all his things <br> You set out to curse his name and have a few <br> And I'll bet you're doin' your best to move on <br> Well, you're not the only lonely one <br> This ain't my first rodeo <br> I've seen the other side of this bar <br> Pourin' salts on an open wound <br> Sittin' right there where you are <br> And I know it probably stings right now <br> Somehow more than that Jim Bean <br> But that clock on the wall will cure it all  <br>  <br>  <br>  <br> Even though that ain't how it seems <br> I've seen girls like you in here before <br> Watched broken hearts break <br> Though that door a time or two <br> And I'll bet he packed all his things <br> You set out to curse his name and have a few <br> And I'll bet you're doin' your best to move on <br> Well, you're not the only lonely one <br> I've seen 'em come, I've seen 'em go <br> Girl, you ain't in this thing alone <br> Oh no, oh no <br> I've seen girls like you in here before <br> Watched broken hearts break <br> Though that door a time or two <br> And I'll bet he packed all his things <br> You set out to curse his name and have a few <br> And I'll bet you're doin' your best to move on <br> Well, you're not the only lonely one <br> No, you're not the only lonely one"
Memories Are Made Of,"Cheap boat, 6 pack of something light <br> A fireball burning up a blue sky <br> A Mercury 93, wasn't even half pa** noon <br> A first taste of freedom after high school <br> Breaking hearts, curfews and momma's rules <br> I just laugh thinking 'bout all the sh** we got into <br> Yeah those were the days we thought we'd never lose <br> But we did, and we miss <br> How it was when we were just kids <br> Lookin' back on the past <br> Wasn't much but it's what we had <br> Just a couple buds and a good buzz is all it was <br> But that's what memories are made of <br> It's been so long since me and Katy first met <br> We lost touch [?] used when <br> Flying past, fading fast, wishing I could make her mine <br> There some things, the same to take you right back  <br>  <br>  <br>  <br> I see her face every time I hear that <br> Lynyrd Skynyrd [?] her arms in my mind <br> Yeah those were the days we thought we'd never lose, never lose <br> But we did, and we miss <br> How it was when we were just kids <br> Lookin' back on the past <br> Wasn't much but it's what we had <br> Just a good buzz from a summer love was all it was <br> Yeah that's what memories are made of <br> Yeah those were the days we thought we'd never lose <br> But we did, and we miss <br> How it was when we were just kids <br> Lookin' back on the past <br> Wasn't much but it's what we had <br> Just a couple buds and a good buzz was all it was <br> Yeah a summer love was all it was <br> But that's what memories are made of"
Must've Never Met You,"Just pick yourself up, dust yourself off <br> They say it ain't that hard <br> But just putting one foot in front of the other ain't getting me too far <br> This moving on ain't coming along the way they said it would <br> I guess whoever said ""the gra** is greener"" <br> Must've never seen the other side <br> And ""what don't k** you makes you stronger"" <br> Sure sounds like a lie <br> And whoever said that ""time heals everything and everything will be alright"" <br> Whoever said ""it ain't the end of the world and you'll find somebody new"" <br> Must've never met you <br> Must've never met you <br> Must've never heard you say you'd never leave me <br> Then watch you walk away <br> Must've never fell as hard as I did <br> 'Cause then they wouldn't say <br> ""Maybe it wasn't meant to be, yeah maybe you're better off alone""  <br>  <br>  <br>  <br> I guess whoever said ""the gra** is greener"" <br> Must've never seen the other side <br> ""What don't k** you makes you stronger"" <br> Sure sounds like a lie <br> And whoever said that ""time heals everything and everything will be alright"" <br> Whoever said ""it ain't the end of the world and you'll find somebody new"" <br> Must've never met you <br> Must've never met you <br> I guess whoever said ""the gra** is greener"" <br> Must've never seen the other side <br> ""What don't k** you makes you stronger"" <br> Still sounds like a lie <br> And whoever said that ""time heals everything and everything will be alright"" <br> Whoever said ""it ain't the end of the world, you know she ain't the only girl"" <br> ""You win, you lose, you find somebody new"" <br> Must've never met you <br> Must've never met you"
One Number Away,"[Verse 1] <br> Are you sitting at home, all alone, trying to fall asleep? <br> Are you staring a hole through your phone, praying that it rings? <br> Are you watching a movie that you’ve seen a thousand times? <br> Or maybe playing some Mayer, getting lost in your favorite lines <br> [Pre-Chorus] <br> Well, if you’re anything like me <br> You just might be doing whatever it takes <br> To drown out the noise <br> But I just wanna hear your voice <br> [Chorus] <br> And I’m one number away <br> From calling to you <br> I said I was through <br> But I’m dying, inside <br> Got my head in a mess <br> Girl, I confess <br> I lied when I said <br> “I’m leaving and not coming back” <br> Might be the whiskey or the midnight rain <br> But everywhere I go, I see your face <br> In my brain, dial it up, everything I wanna say <br> But I’m still one number away <br> [Verse 1] <br> Are you stuck at a red light with a Marlboro Light on your lips? <br> Does the smoke in your mirror get clearer without my kiss? <br> Are you changing the station replacing our favorite songs? <br> Well maybe it’s a mistake, hit the brakes, I’m moving on <br>  <br>  <br>  <br>  <br> [Pre-Chorus 2] <br> Well, if you’re anything like me <br> You just might be doing whatever it takes <br> To outrun the storm <br> But I’m almost out that door <br> [Chorus] <br> And I’m one number away <br> From calling to you <br> I said I was through <br> But I’m dying, inside <br> Got my head in a mess <br> Girl, I confess <br> I lied when I said <br> “I’m leaving and not coming back” <br> Might be the whiskey or the midnight rain <br> But everywhere I go, I see your face <br> In my brain, dial it up, everything I wanna say <br> But I’m still one number away <br> [Bridge] <br> Will you pick up when I call? <br> Or just forget we loved at all <br> We don’t have to talk <br> I just wanna hear your voice <br> [Chorus] <br> And I’m one number away <br> From calling to you <br> I said I was through <br> But I’m dying, inside <br> Got my head in a mess <br> Girl, I confess <br> I lied when I said <br> “I’m leaving and not coming back” <br> Might be the whiskey or the midnight rain <br> But everywhere I go, I see your face <br> In my brain, dial it up, everything I wanna say <br> But I’m still one number away, away, away <br> Yeah I’m still one number away"
Out There,"BFG’s coming ‘cross the creek <br> Z71, headlights shinning through the trees <br> The boy spill out the backseat <br> And ask me, what’s it gonna be tonight? <br> I said, I’m just trying to get loose trying to make a moves <br> It don’t matter of what we do <br> As long we’re out there somewhere <br> Where can go <br> Get away from it all, get lost <br> And god, only He knows <br> Where we’ll go <br> And hell, I don’t care <br> As long we’re out there <br> We pulled in threw it in park <br> And followed the orange glow in the dark in the trail marks  <br>  <br>  <br>  <br> Through the fire flames, we locked eyes <br> She walked over form the other side and smiled <br> Well I said <br> I said I’m just trying to get loose trying to set the mood <br> Don’t matter what we do (Yeah, what we do) <br> As long as we ‘re out there somewhere <br> Where we can go <br> Get away from it all, get <br> And God only knows <br> Where well go <br> And, hell I don’t care <br> As long we’re out there <br> As long we’re out there <br> Yeah"
She Got the Best of Me,"[Verse 1: Luke Combs] <br> Seventeen, you don't think that much about life <br> You just live it <br> Like Kerosene dancing around a fire <br> But you're in it <br> [Pre-Chorus: Luke Combs] <br> So you jump right in <br> Ain't afraid to fall <br> And you give it all <br> [Chorus: Luke Combs] <br> She got the best of me <br> She broke my heart <br> Now all that's left of me <br> Is beating in this guitar <br> Every night, a different sound <br> She follows me around <br> So you get what's left of me  <br>  <br>  <br>  <br> She got the best of me <br> [Verse 2: Luke Combs] <br> I picked myself up off the floor <br> And found something new worth living for <br> And a, old dusty hand-me-down six string <br> And a couple chords <br> [Bridge: Luke Combs] <br> I'm getting over her <br> A little more with every song <br> So sing a-long <br> [Chorus: Luke Combs] <br> [Outro: Luke Combs] <br> She got the best of me <br> She got the best of me <br> She got the best of me"
South On Ya,"Way down where the sun shines hotter <br> Dog's on the porch <br> Gator's in the water <br> Way down, down in Alabama <br> Muddy Mississippi <br> Swampy Louisiana <br> We come up a little different 'round here <br> We got a little dirt road dust runnin' through our blood <br> From a never heard of it hometown <br> I got a can't quit heart and some take it too far <br> And a whole lot of never back down <br> If you come around here, better bring it 'cause we're no doubt <br> Gonna put a little South on ya <br> We hold it down from Texas to Missouri <br> From the Arkansas Hollers <br> And the grass in Kentucky <br> To the blue skies in Carolina <br> Florida, Tennessee and Georgia <br> Come and find us <br> Man, we got it made down here  <br>  <br>  <br>  <br> We got a little dirt road dust runnin' through our blood <br> From a never heard of it hometown <br> I got a can't quit heart and some take it too far <br> And a whole lot of never back down <br> If you come around here, better bring it 'cause we're no doubt <br> Gonna put a little South on ya <br> I don't care what anybody says <br> That sh*t can turn to South, man, come on <br> We got a little dirt road dust runnin' through our blood <br> From a never heard of it hometown <br> I got a can't quit heart and some take it too far <br> And a whole lot of never back down <br> If you come around here, better bring it 'cause we're no doubt <br> Gonna put a little South on yaaa"
The great divide,"We’re striking matches on the TV <br> Setting fires on our phones <br> Bearing crosses we believe in dying on <br> Tempers flare, the flame flies higher <br> As we soar closer towards the sun <br> But I like to think too much damage ain’t been done <br> We’re all so far, so far apart now <br> It’s as deep as it is wide <br> We’re about to fall apart now <br> If we can’t reach the other side <br> We gotta find a way across the great divide <br> Sometimes it seems that our convictions <br> Side of the fence that we stand on <br> Makes us all too damn different to get along  <br>  <br>  <br>  <br> But I’ve seen strangers love each other <br> Like a mother does her son <br> Versuri-lyrics.info <br> What we see ain’t only all that’s going on <br> We’re all so far, so far apart now <br> It’s as deep as it is wide <br> We’re about to fall apart now <br> If we can’t reach the other side <br> We gotta find a way across the great divide <br> We’re all so far, so far apart now <br> It’s as deep as it is wide <br> We’re about to fall apart now <br> If we can’t reach the other side <br> We gotta find a way across the great divide <br> The great divideee"
The Way She Rides,"Screamed into the driveway, with my foot stuck on the gas <br> Had the Crown mixed up in a Dixie cup, when she hopped into the cab <br> She said ""Boy what you got in store, what we getting into tonight?"" <br> Hell, I don't care, I'll go anywhere, just as long as you're by my side <br> [Chorus:] <br> Whether she's sitting shotgun with her hair done <br> Or with the seat leaned back with the radio on <br> Or the backstreets, in the backseat <br> Those baby blue eyes staring back at me  <br>  <br>  <br>  <br> Whether it's in park or it's in drive <br> I love the way she rides <br> So we hit that ground a running throwing coughs into the wind <br> Well it wasn't long before that drink was gone, and she was shaking that a** again <br> She said find somewhere dark where we can park, and put a hurting on this bottle <br> So we said goodnight to the city lights, and kicked in full throttle <br> [Chorus] <br> [Chorus]"
This One's for You,"There’s a couple people that I owe a beer or two <br> And three or four I owe more than a few <br> For all the times I couldn’t find the answers <br> Stumbling through the dark without a clue <br> This one’s for you <br> Mom and daddy always did their best <br> For a crazy fool who couldn’t help himself <br> I thank God they were there to see me through <br> This one’s for you <br> I told you all I’d write you a song <br> Pour my heart in the melody <br> To keep you singing along <br> This might not be the right time <br> These might not be the right lines to prove <br> For saying what I’m trying to <br> This one’s for you <br> I’ve been knocked down time and time again <br> Got picked back up by love and few good friends <br> Who reminded me of all I stood to lose <br> This one’s for you  <br>  <br>  <br>  <br> Yeah I told you all I’d write you a song <br> Pour my heart in the melody <br> To keep you singing along <br> This might not be the right time <br> These might not be the right lines to prove <br> For saying what I’m trying to <br> This one’s for you <br> Made more than my fair share of mistakes <br> Bridges burned and lessons learned <br> A few things that I can’t change <br> Some apologies are way past overdue <br> So this one’s for you <br> Oh, I told you all I’d write you a song <br> Pour my heart in the melody <br> To keep you singing along <br> This might not be the right time <br> And these might not be the right lines to prove <br> For saying what I’m trying to <br> This one’s for you <br> There’s a couple people that I owe a beer or two <br> And three or four I owe than a few"
Used To You,"That old phone of mine, 2:39 AM when I got the call <br> Half asleep, thought it was a dream, but it wasn't afterall <br> That old dog of yours, sitting on the porch, waits for you to come home <br> Little does he know that you won't be walking through that door <br> I just leave him alone, cause lettin' go don't come that easily <br> Most of the time I can get by - it's just a little hard on me <br> But I'm gettin' used to that old truck of yours sittin' out in the drive <br> I'm gettin' used to you not bein' there, at church on Sunday night <br> I'm gettin' used to the radio playin' without you singin' along <br> But I'll never get used to you bein' gone <br> That old rockin' chair sittin over there, it don't rock no more <br> And that old six string ain't played a thing, been awhile since it's hummed a chord <br> Just leave em alone cause lettin' go don't come that easily  <br>  <br>  <br>  <br> Most of the time I can get by - it's just a little hard on me <br> But I'm gettin' used to that old truck of yours sittin' out in the drive <br> I'm gettin' used to you not bein' there, at church on Sunday night <br> I'm gettin' used to the radio playin' without you singin' along <br> But I'll never get used to you bein' gone <br> There's a lot of things in this whole world I can stand <br> But when it comes to losin' you, I just can't <br> Yeah, I'm gettin' used to that old truck of yours sittin' out in the drive <br> I'm gettin' used to you not bein' there, at church on Sunday night <br> I'm gettin' used to the radio playin' without you singin' along <br> But I'll never get used to, no I'll never get used to you bein' gone <br> Yeah, bein' gone <br> I'm never gettin' used to you bein' gone"
When It Rains It Pours,"Sunday morning, man, she woke up fighting mad <br> b**hing and moaning on and on ’bout the time I had <br> And by Tuesday, you could say that girl was good as gone <br> Then when Thursday came around, I was all alone <br> So I went for a drive to clear my mind, ended up at a Shell on I-65 <br> Then I won a hundred bucks on a scratch off ticket <br> Bought two twelve packs and a tank of gas with it <br> She swore they were a waist of time, oh, but she was wrong <br> I was caller number 5 on a radio station, won a 4-day, 3-night, beach vacation <br> Deep sea, senorita, fishing down in Panama <br> And I ain’t gotta see my ex future mother-in-law anymore <br> Oh lord, when it rains it pours <br> When it rains it pours <br> Now she was sure real quick to up and apologize <br> When she heard about my new found luck on that FM dial <br> And it’s crazy how this now just seems to come in when <br> What I thought was gonna be the d**h of me was my saving grace <br> It’s got me thinking that her leaving is the only logical reason  <br>  <br>  <br>  <br> That I got the last spot in the Hooter’s parking lot <br> And the waitress left her number on my check with a heart <br> She picked up on the first ring when I gave her a call <br> And I only spent five bucks at the Moose Club Raffle <br> Won a used four-wheeler and three free pa**es <br> For me and two of my buddies to play a round of golf <br> And I ain’t gotta see my ex future mother-in-law anymore <br> Oh lord, when it rains it pours <br> When it rains it pours <br> Well I’ve been on a hell of a redneck road for three weeks now <br> And it all started on the day that she walked out <br> Then I won a hundred bucks on a scratch off ticket <br> Bought two twelve packs and a tank of gas with it <br> She swore they were a waist of time, oh, but she was wrong <br> I was caller number 5 on a radio station, won a 4-day, 3-night, beach vacation <br> Deep sea, senorita, fishing down in Panama <br> And I ain’t gotta see my ex future mother-in-law anymore <br> Oh lord, when it rains it pours <br> When it rains it pours"
