Song Title,Lyrics
evermore,"(feat. Bon Iver) <br> Gray November <br> I've been down since July <br> Motion capture <br> Put me in a bad light <br> I replay my footsteps on each stepping stone <br> Trying to find the one where I went wrong <br> Writing letters <br> Addressed to the fire <br> And I was catching my breath <br> Staring out an open window <br> Catching my death <br> And I couldn't be sure <br> I had a feeling so peculiar <br> That this pain would be for <br> Evermore <br> Hey December <br> Guess I'm feeling unmoored <br> Can't remember <br> What I used to fight for <br> I rewind the tape but all it does is pause <br> On the very moment all was lost <br> Sending signals <br> To be double crossed <br> And I was catching my breath <br> Barefoot in the wildest winter <br> Catching my death <br> And I couldn't be sure <br> I had a feeling so peculiar <br> That this pain would be for <br> Evermore <br> (Evermore) <br> Can't not think of all the cost <br> And the things that will be lost <br> Oh, can we just get a pause?  <br>  <br>  <br>  <br> To be certain we'll be tall again <br> Whether weather be the frost <br> Or the violence of the dog days <br> I'm on waves, out being tossed <br> Is there a line that I could just go cross? <br> And when I was shipwrecked (Can't think of all the cost) <br> I thought of you (All the things that will be lost now) <br> In the cracks of light (Can we just get a pause?) <br> I dreamed of you (To be certain we'll be tall again) <br> (If you think of all the costs) <br> It was real enough (Whether weather be the frost) <br> To get me through (Or the violence of the dog days) <br> (Out on waves being tossed) <br> I swear (Is there a line that we could just go cross?) <br> You were there <br> And I was catching my breath <br> Floors of a cabin creaking under my step <br> And I couldn't be sure <br> I had a feeling so peculiar <br> This pain wouldn't be for <br> Evermore <br> Evermore <br> Evermore <br> This pain wouldn't be for evermore <br> Evermore"
Everything Has Changed,"(duet with Ed Sheeran) <br> [Taylor Swift] <br> All I knew this morning when I woke <br> Is I know something now, know something now I didn't before <br> And all I've seen since eighteen hours ago <br> Is green eyes and freckles and your smile <br> In the back of my mind making me feel like <br> I just wanna know you better know you better know you better now <br> I just wanna know you better know you better know you better now <br> I just wanna know you better know you better know you better now <br> I just wanna know you know you know you <br> 'Cause all I know is we said ""Hello"" <br> And your eyes look like coming home <br> All I know is a simple name <br> Everything has changed <br> All I know is you held the door <br> You'll be mine and I'll be yours <br> All I know since yesterday is everything has changed <br> [Ed Sheeran] <br> And all my walls stood tall painted blue <br> And I'll take them down, take them down and open up the door for you <br> [Taylor Swift] <br> And all I feel in my stomach is bu*terflies <br> The beautiful kind, making up for lost time, <br> Taking flight, making me feel like <br> I just wanna know you better know you better know you better now <br> I just wanna know you better know you better know you better now  <br>  <br>  <br>  <br> I just wanna know you better know you better know you better now <br> I just wanna know you know you know you <br> 'Cause all I know is we said ""Hello"" <br> And your eyes look like coming home <br> All I know is a simple name <br> Everything has changed <br> All I know is you held the door <br> You'll be mine and I'll be yours <br> All I know since yesterday is everything has changed <br> Come back and tell me why <br> I'm feeling like I've missed you all this time, oh, oh, oh <br> And meet me there tonight <br> And let me know that it's not all in my mind <br> [Taylor Swift] <br> I just wanna know you better know you better know you better now <br> I just wanna know you know you know you <br> [Both] <br> 'Cause all I know is we said ""Hello"" <br> And your eyes look like coming home <br> All I know is a simple name <br> Everything has changed <br> All I know is you held the door <br> You'll be mine and I'll be yours <br> All I know since yesterday is everything has changed <br> All I know is we said ""Hello"" <br> So dust off your highest hopes <br> All I know is pouring rain and everything has changed <br> All I know is the new found grace <br> All my days I know your face <br> All I know since yesterday is everything has changed"
Everything Has Changed (Remix),"Ed Sheeran <br> We good to go? <br> Taylor Swift <br> All I knew this morning when I woke <br> Is I know something now, know something now <br> I didn't before <br> And all I've seen since eighteen hours ago <br> Is green eyes and freckles <br> And your smile in the back of my mind making me feel like <br> I just want to know you better <br> Know you better, know you better now <br> I just want to know you better <br> Know you better, know you better now <br> Taylor Swift & Ed Sheeran <br> I just want to know you better <br> Know you better, know you better now <br> I just want to know you <br> Know you, know you <br> 'Cause all I know is we said hello <br> And your eyes look like coming home <br> All I know is a simple name <br> Everything has changed <br> All I know is you held the door <br> You'll be mine and I'll be yours <br> All I know since yesterday <br> Is everything has changed <br> Ed Sheeran <br> And all my walls <br> Stood tall painted blue <br> But I'll take them down <br> Take them down and open up the door for you <br> Taylor Swift <br> And all I feel in my stomach is bu*terflies <br> The beautiful kind, making up for lost time <br> Taking flight, making me feel like <br> Taylor Swift & Ed Sheeran <br> I just want to know you better <br> Know you better, know you better now <br> I just want to know you better <br> Know you better, know you better now  <br>  <br>  <br>  <br> I just want to know you better <br> Know you better, know you better now <br> I just want to know you <br> Know you, know you <br> 'Cause all I know is we said hello <br> And your eyes look like coming home <br> All I know is a simple name <br> Everything has changed <br> All I know is you held the door <br> You'll be mine and I'll be yours <br> All I know since yesterday <br> Is everything has changed <br> Come back and tell me why <br> I'm feeling like I've missed you all this time <br> And meet me there tonight <br> And let me know that it's not all in my mind <br> Taylor Swift <br> I just want to know you better <br> Know you better, know you better now <br> I just want to know you <br> Know you, know you <br> Taylor Swift & Ed Sheeran <br> All I know is we said hello <br> Your eyes look like coming home <br> All I know is a simple name <br> Everything has changed <br> All I know is you held the door <br> You'll be mine and I'll be yours <br> All I know since yesterday <br> Is everything has changed <br> Taylor Swift <br> All I know is we said hello <br> So dust off your highest hopes <br> All I know is pouring rain <br> Taylor Swift & Ed Sheeran <br> And everything has changed <br> Taylor Swift <br> All I know is a newfound grace <br> All my days I'll know your face <br> All I know since yesterday <br> Taylor Swift & Ed Sheeran <br> Is everything has changed"
Everything Has Changed (Taylor’s Version),"[Intro: Ed Sheeran] <br> (You good to go?) <br> [Verse 1: Taylor Swift] <br> All I knew this morning when I woke <br> Is I know something now <br> Know something now I didn't before <br> And all I've seen since 18 hours ago <br> Is green eyes and freckles and your smile <br> In the back of my mind, making me feel like <br> [Pre-Chorus: Taylor Swift, Taylor Swift & Ed Sheeran] <br> I just wanna know you better <br> Know you better, know you better now <br> I just wanna know you better <br> Know you better, know you better now <br> I just wanna know you better <br> Know you better, know you better now <br> I just wanna know you, know you, know you <br> [Chorus: Taylor Swift & Ed Sheeran] <br> 'Cause all I know is we said, ""Hello"" <br> And your eyes look like coming home <br> All I know is a simplе name <br> Everything has changed <br> All I know is you hеld the door <br> You'll be mine and I'll be yours <br> All I know since yesterday <br> Is everything has changed <br> [Verse 2: Ed Sheeran & Taylor Swift] <br> And all my walls stood tall, painted blue <br> And I'll take 'em down, take 'em down <br> And open up the door for you <br> And all I feel in my stomach is bu*terflies <br> The beautiful kind, makin' up for lost time <br> Takin' flight, making me feel like <br> [Pre-Chorus: Taylor Swift & Ed Sheeran] <br> I just wanna know you better <br> Know you better, know you better now <br> I just wanna know you better <br> Know you better, know you better now <br>  <br>  <br>  <br> I just wanna know you better <br> Know you better, know you better now <br> I just wanna know you, know you, know you <br> [Chorus: Taylor Swift & Ed Sheeran] <br> 'Cause all I know is we said, ""Hello"" <br> And your eyes look like coming home <br> All I know is a simple name <br> Everything has changed <br> All I know is you held the door <br> You'll be mine and I'll be yours <br> All I know since yesterday <br> Is everything has changed <br> [Bridge: Taylor Swift & Ed Sheeran] <br> Come back and tell me why <br> I'm feeling like I've missed you all this time <br> And meet me there tonight <br> And let me know that it's not all in my mind <br> [Pre-Chorus: Taylor Swift] <br> I just wanna know you better <br> Know you better, know you better now <br> I just wanna know you, know you, know you <br> [Chorus: Taylor Swift & Ed Sheeran] <br> All I know is we said, ""Hello"" <br> And your eyes look like coming home <br> All I know is a simple name <br> Everything has changed <br> All I know is you held the door <br> And you'll be mine and I'll be yours <br> All I know since yesterday <br> Is everything has changed <br> [Outro: Taylor Swift, Taylor Swift & Ed Sheeran] <br> All I know is we said, ""Hello"" <br> So dust off your highest hopes <br> All I know is pouring rain <br> And everything has changed <br> All I know is a new found grace <br> All my days, I'll know your face <br> All I know since yesterday <br> Is everything has changed"
Eyes Open,"Everybody's waiting, <br> Everybody's watching, <br> Even when you're sleeping, <br> Keep your e-eyes open. <br> The tricky thing, <br> Is yesterday we were just children, <br> Playing soldiers, just pretending, <br> Dreaming dreams with happy endings. <br> In backyards, <br> Winning battles with our wooden swords, <br> But now we've stepped into a cruel world. <br> Where everybody stands and, <br> Keeps score. <br> Keep your eyes open. <br> [Chorus:] <br> Everybody's waiting, for you to breakdown. <br> Everybody's watching, to see the fallout. <br> Even when you're sleeping, sleeping, <br> Keep your e-eyes open. <br> Keep your e-eyes open. <br> Keep your e-eyes open. <br> So here you are, <br> Two steps ahead, and staying on guard. <br> Every lesson forms a new scar, <br> They never thought you'd make it this far. <br> But turn around (turn around), <br> Oh, they've surrounded with a showdown (showdown). <br> And nobody comes to save you now.  <br>  <br>  <br>  <br> But you got something they don't, <br> Yeah, you got something they don't. <br> You just gotta keep your eyes open. <br> [Chorus:] <br> Everybody's waiting, for you to breakdown. <br> Everybody's watching, to see the fallout. <br> Even when you're sleeping, sleeping, <br> Keep your e-eyes open. <br> Keep your e-eyes open. <br> Keep your eyes... <br> Keep your feet ready, <br> Heartbeat steady, <br> Keep your eyes open. <br> Keep your aim locked, <br> The night grows dark, <br> Keep your eyes open. <br> Keep your e-eyes open, <br> Keep your e-eyes open, <br> Keep your e-eyes open, <br> Keep your e-eyes open. <br> [Chorus:] <br> Everybody's waiting, for you to breakdown. <br> Everybody's watching, to see the fallout. <br> Even when you're sleeping, sleeping, <br> Keep your e-eyes open. <br> Keep your eyes open! <br> Keep your e-eyes open. <br> Keep your eyes open! <br> Keep your e-eyes open."
Fall Back On You,"[Verse 1] <br> Isn't it funny how many times we can say <br> We drawn the line, cross it out, turn the page <br> And moved on <br> That's what we thought <br> But here I am in the same old car <br> Having myself another same old brown-eyed bar <br> Uh oh, uh oh <br> [Pre-Chorus] <br> I won't tell nobody <br> I won't tell my friends <br> We'll just drive down this road till the one we're on ends <br> And we'll tell each other things like I need you <br> [Chorus] <br> You and me  <br>  <br>  <br>  <br> Baby this is what we do <br> I may see <br> There are people you just come back to <br> So fall back on me <br> Fall back on you <br> [Verse 2] <br> You always let someone come in between <br> Your talking round the truth and never say what we mean <br> Look at all this wasted time <br> [Pre-Chorus] <br> [Chorus] <br> [Bridge] <br> Maybe we'll last <br> Maybe we won't <br> Maybe we'll stop talking and I'll haunt you like a ghost <br> But just, baby, get along with me <br> [Chorus]"
Fearless,"[Verse 1] <br> There's something 'bout the way <br> The street looks when it's just rained <br> There's a glow off the pavement <br> You walk me to the car <br> And you know I wanna ask you to dance right there <br> In the middle of the parking lot <br> Yeah <br> Oh yeah <br> We're driving down the road <br> I wonder if you know <br> I'm trying so hard not to get caught up now <br> But you're just so cool <br> Run your hands through your hair <br> Absent mindedly making me want you <br> [Chorus] <br> And I don't know how it gets better than this <br> You take my hand and drag me head first <br> Fearless <br> And I don't know why but with you I'd dance in a storm in my best dress <br> Fearless <br> [Verse 2] <br> So baby drive slow <br> 'til we run out of road in this one horse town <br> I wanna stay right here in this pa**enger's seat <br> You put your eyes on me <br> In this moment now capture it, remember it <br>  <br>  <br>  <br>  <br> [Chorus] <br> And I don't know how it gets better than this <br> You take my hand and drag me head first <br> Fearless <br> And I don't know why but with you I'd dance in a storm in my best dress <br> Fearless <br> [Bridge] <br> Well you stood there with me in the doorway <br> My hands shake <br> I'm not usually this way but <br> You pull me in and I'm a little more brave <br> It's the first kiss <br> It's flawless <br> Really something <br> It's fearless <br> Oh yeah <br> [Chorus] <br> And I don't know how it gets better than this <br> You take my hand and drag me head first <br> Fearless <br> And I don't know why but with you I'd dance in a storm in my best dress <br> Fearless <br> [Chorus] <br> And I don't know how it gets better than this <br> You take my hand and drag me head first <br> Fearless <br> And I don't know why but with you I'd dance in a storm in my best dress <br> Fearless <br> [Outro] <br> Oh oh <br> Oh yeah"
"Fearless / I'm Yours / Hey, Soul Sister","There's somethin' 'bout the way <br> The street looks when it's just rained <br> There's a glow off the pavement <br> Walk me to the car <br> And you know I wanna ask you to dance right there <br> In the middle of the parking lot <br> Yeah <br> Oh yeah <br> Hey, hey, hey <br> We're drivin' down the road <br> I wonder if you know <br> I'm tryin' so hard not to get caught up now <br> But you're just so cool <br> Run your hands through your hair <br> Absentmindedly makin' me want you <br> And I don't know how it gets better than this <br> You take my hand and drag me headfirst <br> Fearless <br> And I don't know why when with you I'd dance <br> In a storm in my best dress <br> Fearless <br> Hey, hey, hey  <br>  <br>  <br>  <br> So baby drive slow <br> 'Til we run out of road in this one horse town <br> I wanna stay right here in this pa**enger seat <br> You put your eyes on me <br> In this moment now, capture it, remember it <br> Cuz I don't know how it gets better than this <br> You take my hand and drag me headfirst <br> Fearless <br> And I don't know why but with you I'd dance <br> In a storm in my best dress <br> Fearless <br> But I won't hesitate no more, no more <br> It cannot wait, I'm yours <br> Hey, hey, hey <br> Cuz I don't know how it gets better than this <br> You take my hand and drag me headfirst <br> Fearless <br> And I don't know why but with you I'd dance <br> In a storm in my best dress <br> Fearless"
Fearless Tour Costumes," <br>  <br>  <br>  <br> ""You Belong With Me"" ""Our Song"" / ""Tell Me Why"" / ""Teardrops On My Guitar"" / ""Fearless"" ""Forever And Always"" ""Hey Stephen"" / ""Fifteen"" / ""Tim McGraw"" / ""White Horse"" ""Love Story"" ""The Way I Loved You"" / ""You're Not Sorry / What Goes Around.../Comes Around"" / ""Picture To Burn"" / ""Change"" ""I'm Only Me When I'm With You"" / ""Should've Said No"""
Fearless Tour Setlist,"1. ""You Belong With Me"" <br> 2. ""Our Song"" <br> 3. ""Tell Me Why"" <br> 4. ""Teardrops On My Guitar"" <br> 5. ""Fearless"" <br> 6. ""Forever and Always"" <br> 7. ""Hey Stephen"" <br> 8. ""Fifteen"" <br> 9. ""Tim McGraw"" <br> 10. ""White Horse"" <br> 11. ""Love Story"" <br> 12. ""The Way I Loved You""  <br>  <br>  <br>  <br> 13. ""You're Not Sorry/ What Goes Around.../...Comes Around"" <br> 14. ""Picture to Burn"" <br> 15. ""Change"" <br> ENCORE: <br> 16. ""I'm Only Me When I'm With You"" (performed with Kellie Pickler and Gloriana) <br> 17. ""Should've Said No"""
Fifteen,"[Verse 1] <br> You take a deep breath and you walk through the doors <br> It's the morning of your very first day <br> You say hi to your friends you haven't seen in a while <br> Try and stay out of everybody's way <br> It's your freshman year and you're going to be here <br> For the next four years in this town <br> Hoping one of those senior boys will wink at you and say <br> ""You know, I haven't seen you around before"" <br> [Chorus] <br> Because when you're fifteen and somebody tells you they love you <br> You're going to believe them <br> And when you're fifteen feeling like there's nothing to figure out <br> Well, count to ten, take it in <br> This is life before you know who you're going to be <br> Fifteen <br> [Verse 2] <br> You sit in cla** next to a redhead named Abigail <br> And soon enough you're best friends <br> Laughing at the other girls who think they're so cool <br> We'll be outta here as soon as we can <br> And then you're on your very first date and he's got a car <br> And you're feeling like flying <br> And you're momma's waiting up and you're thinking he's the one <br> And you're dancing 'round your room when the night ends <br> When the night ends  <br>  <br>  <br>  <br> [Chorus] <br> Because when you're fifteen and somebody tells you they love you <br> You're going to believe them <br> When you're fifteen and your first kiss <br> Makes your head spin 'round <br> But in your life you'll do things greater than <br> Dating the boy on the football team <br> But I didn't know it at fifteen <br> [Verse 3] <br> When all you wanted was to be wanted <br> Wish you could go back and tell yourself what you know now <br> Back then I swore I was going to marry him someday <br> But I realized some bigger dreams of mine <br> And Abigail gave everything she had to a boy <br> Who changed his mind and we both cried <br> [Chorus] <br> Because when you're fifteen and somebody tells you they love you <br> You're going to believe them <br> And when you're fifteen, don't forget to look before you fall <br> I've found time can heal most anything <br> And you just might find who you're supposed to be <br> I didn't know who I was supposed to be at fifteen <br> La la la la la la la la la la <br> La la la la la la la la la la <br> La la la la la la <br> [Outro] <br> Your very first day <br> Take a deep breath girl <br> Take a deep breath as you walk through the doors"
Firefly,"Someone struck a match against the night <br> All I could see was you and I <br> I was captivated <br> A perfect little dream inside my head <br> And then reality crept in, and erased it <br> For a while I thought that I could hold you <br> But you were just a temporary high <br> [Chorus] <br> Firefly you drew me to you <br> Your beauty shines and lights up the sky <br> And you don't know it, do you?  <br>  <br>  <br>  <br> I wish I could keep you firefly <br> Firefly <br> Something so beautiful and free <br> Was as never meant to be caged in <br> I thought I had you in my hand <br> I tried to catch you, but I can't <br> Chase the wind <br> And just as I reach out to touch you <br> I remind myself you were meant to fly <br> [Chorus] <br> I like to think I'd be all that you wanted <br> Not even that is enough <br> [Chorus]"
Foever And Always,"Once upon a time, I believe it was a Tuesday when I caught your eye <br> And we caught onto something <br> I hold onto the night, you looked me in the eye and told me you loved me <br> Were you just kidding? <br> 'Cause it seems to me, this thing is breaking down <br> We almost never speak <br> I don't feel welcome anymore <br> Baby what happened? Please tell me <br> 'Cause one second it was perfect, now you're halfway out the door <br> And I stare at the phone, he still hasn't called <br> And you feel so low you can't feel nothing at all <br> And you flashback to when he said forever and always <br> Oh, and it rains in your bedroom <br> Everything is wrong <br> It rains when you're here and it rains when you're gone <br> 'Cause I was there when you said forever and always <br> Was I out of line? <br> Did I say something way to honest, made you run and hide <br> Like a scared little boy <br> I looked into your eyes <br> Though I knew you for a minute, now I'm not so sure <br>  <br>  <br>  <br> So here's to everything coming down to nothing <br> Here's to silence, that cuts me to the core <br> Where is this going? Though I knew for a minute, but I don't anymore <br> You didn't mean it baby, I don't think so <br> Oh back up, baby, back up <br> Did you forget everything? <br> Back up, baby, back up <br> Did you forget everything? <br> 'Cause it rains in your bedroom <br> Everything is wrong <br> It rains when you're here and it rains when your gone <br> 'Cause I was there when you said forever and always <br> Oh, I stare at the phone, he still hasn't called <br> And then you feel so low you can't feel nothing at all <br> And the flashback to when you said forever and always <br> And it rains in your bedroom <br> Everything is wrong <br> It rains when you're here and it rains when you're gone <br> 'Cause I was there when you said forever and always <br> You didn't mean it baby, <br> You said forever and always, Yeah"
Forever & Always,"Once upon a time <br> I believe it was a Tuesday when I caught your eye <br> We caught onto something <br> I hold onto the night <br> You looked me in the eye and told me you loved me <br> Were you just kidding? <br> 'Cause it seems to me <br> This thing is breaking down, we almost never speak <br> I don't feel welcome anymore <br> Baby what happened, please tell me <br> 'Cause one second it was perfect <br> Now you're halfway out the door <br> And I stare at the phone, he still hasn't called <br> And then you feel so low you cant feel nothing at all <br> And you flashback to when he said forever and always <br> Oh, and it rains in your bedroom, everything is wrong <br> It rains when you're here and it rains when you're gone <br> 'Cause I was there when you said forever and always <br> Was I out of line? <br> Did I say something way too honest <br> Made you run and hide like a scared little boy <br> I looked into your eyes <br> Thought I knew you for a minute <br> Now I'm not so sure <br> So here's to everything <br> Coming down to nothing <br> Here's to silence that cuts me to the core <br> Where is this going? <br> Thought I knew for a minute, but I don't anymore  <br>  <br>  <br>  <br> And I stare at the phone, he still hasn't called <br> And then you feel so low you cant feel nothing at all <br> And you flashback to when he said forever and always <br> Oh, and it rains in your bedroom, everything is wrong <br> It rains when you're here and it rains when you're gone <br> 'Cause I was there when you said forever and always <br> You didn't mean it, baby <br> I don't think so, ohh <br> Oh, back up, baby, back up <br> Did you forget everything? <br> Back up, baby, back up <br> Did you forget everything? <br> 'Cause it rains in your bedroom, everything is wrong <br> It rains when you're here and it rains when you're gone <br> 'Cause I was there when you said forever and always <br> Oh, I stare at the phone, he still hasn't called <br> And then you feel so low you can't feel nothing at all <br> And you flashback to when we said forever and always <br> And it rains in your bedroom, everything is wrong <br> It rains when you're here and it rains when you're gone <br> 'Cause I was there when you said forever and always <br> You didn't mean it, baby <br> You said forever and always, yeah"
