Song Title,Lyrics
Superman,"[Verse 1] <br> Tall, dark and super manly <br> He puts papers in his briefcase and drives away <br> To save the world or go to work <br> It's the same thing to me <br> He's got his mother's eyes, his father's ambition <br> I wonder if he knows how much that I miss him <br> I hang on every word you say, yay <br> And you smile and say, ""How are you?” <br> I say, ""Just fine"" <br> I always forget to tell you, I love you, I love you forever <br> [Chorus] <br> I watch superman fly away <br> You've got a busy day today <br> Go save the world, I'll be around <br> I watch superman fly away <br> Come back I'll be with you someday <br> I'll be right here on the ground <br> When you come back down <br> [Verse 2] <br> Tall, dark and beautiful <br> He's complicated, he's irrational <br> But I hope someday you'll take me away and save the day, yeah <br> Something in his deep brown eyes has me sayin' <br> He's not all bad like his reputation <br> And I can't hear one single word they say  <br>  <br>  <br>  <br> And you'll leave, got places to be and I'll be OK <br> I always forget to tell you I love you, I loved you from the very first day <br> [Chorus] <br> [Verse 3] <br> And I watch you fly around the world <br> And I hope you don't save some other girl <br> Don't forget, don't forget about me <br> I'm far away but I never let you go <br> I'm love-struck and looking out the window <br> Don't forget, don't forget where I'll be <br> Right here wishing the flowers were from you <br> Wishing the card was from you <br> Wishing the call was from you <br> Cause I loved you from the very first day <br> [Chorus] <br> I watch superman fly away <br> You've got a busy day today <br> Go save the world, I'll be around... <br> Forever and ever here <br> I watch superman fly away <br> I swear I'll be with you someday <br> I'll be right here on the ground <br> When you come back down <br> [Outro] <br> La, la, la, la, la, la <br> La, la, la, la, la, la <br> When you come back down"
Superstar,"This is wrong but I can't help but feel like <br> There ain't nothing more right babe <br> Misty morning comes again and I can't <br> Help but wish I could see your face <br> And I knew from the first note played <br> I'd be breaking all my rules to see you <br> You smile that beautiful smile and <br> All the girls in the front row scream your name <br> So dim that spotlight, tell me things like <br> I can't take my eyes off of you <br> I'm no one special, just another <br> Wide eyed girl who's desperately in love with you <br> Give me a photograph to hang on my wall, superstar <br> Good morning loneliness, comes around when I'm not <br> Dreaming about you <br> When my world wakes up today <br> You'll be in another town <br> And I knew when I saw your face, I'd be <br> Counting down the ways to see you  <br>  <br>  <br>  <br> You smile that beautiful smile and <br> All the girls in the front row scream your name <br> So dim that spotlight, tell me things like <br> I can't take my eyes off of you <br> I'm no one special, just another <br> Wide eyed girl who's desperately in love with you <br> Give me a photograph to hang on my wall, superstar <br> You played in bars, you play guitar <br> I'm invisible and everyone knows who you are <br> And you'll never see, sing me to sleep <br> Every night from the radio <br> So dim that spotlight, tell me things like <br> I can't take my eyes off of you <br> I'm no one special, just another <br> Wide eyed girl who's desperately in love with you <br> Give me a photograph to hang on my wall, superstar <br> Sweet, sweet superstar, superstar"
Sweet Escape,"[Verse 1] <br> If I could be sweet <br> I would but first of all, let me say <br> I must apologize for acting stank and treating you this way <br> Cause I’ve been acting like sour milk all on the floor <br> Its your fault you didn’t shut the refrigerator <br> Maybe that’s the reason I’ve been acting so cold <br> [Chorus] <br> If I could escape <br> And recreate a place that’s my own world <br> And I could be your favorite girl <br> Forever, perfectly together <br> Now tell me boy now wouldn’t that be sweet <br> If I could be sweet <br> Sorry, but I know I’ve been a real bad girl <br> I didn’t mean for you to get hurt <br> Whatsoever <br> We can make it better <br> Now tell me boy now wouldn’t that be sweet <br> Sweet escape, sweet escape <br> [Verse 2] <br> You let me drown <br> I’m at my lowest boiling point <br> Come help me out <br> I need to get me out of this joint  <br>  <br>  <br>  <br> Come on, let’s bounce <br> Counting on you to turn me around <br> Instead of clowning around <br> Let’s look for some common ground <br> Oh baby <br> Times been getting a little crazy <br> I’ve been getting a little lazy <br> Waiting for you to come save me <br> I can see that you’re angry <br> By the way that you treat me <br> Hopefully, you don’t leave me <br> Wanna take you with me <br> [Chorus] <br> If I could escape <br> And recreate a place that’s my own world <br> And I could be your favorite girl <br> Forever, perfectly together <br> Now tell me boy now wouldn’t that be sweet <br> If I could be sweet <br> Sorry, but I know I’ve been a real bad girl <br> I didn’t mean for you to get hurt <br> Whatsoever <br> We can make it better <br> Now tell me boy now wouldn’t that be sweet <br> Sweet escape, sweet escape"
Sweet Tea And God's Graces,"[Verse 1] <br> Tire swings, summer dreams, honeys**le on the breeze <br> Whistle County creek <br> Laying in the green gra**, I was watching clouds pa** <br> Baby, you were watching me <br> Cold barn struck bed, everything you said <br> Slowly educating me <br> I never had a lesson so sweet <br> [Chorus] <br> You can get high on a first kiss <br> You can get by with sweet tea and God's graces <br> You can love like a sinner and lose like a winner <br> Nothing's shatterproof <br> You can crash and burn and come back someone new <br> And that's what I learned from you <br> [Verse 2] <br> Autumn rain, window pane, looking how the leaves change <br> Just like the two of us <br> Still got your laugh, your ghost, your jacket <br> Guess I loved you way too much <br> But I'm a little smarter, my heart's a little harder  <br>  <br>  <br>  <br> But it's still soft enough to cry <br> Cause I remember those times <br> I remember <br> [Chorus] <br> [Verse 3] <br> Saw you just the other day <br> All that I could think to say was <br> ""Hey, how have you been?"" <br> You caught me with that old smile <br> Said, ""It's really been a while <br> And I still think about back when"" <br> [Chorus] <br> We used to get high on the first kiss <br> We could get by with sweet tea and Jesus <br> And you can love like a sinner and lose like a winner <br> Nothing's shatterproof <br> You can crash and burn and now I'm someone new <br> And that's what I learned from you <br> [Outro] <br> Oh, that's what I learned from you <br> That's what I learned from you, oh you, oh <br> That's what I learned from you, oh yeah"
Sweeter Than Fiction,"[Verse 1] <br> Hit the ground, hit the ground, hit the ground (oh, oh) <br> Only sound, only sound that you hear is ""no"" <br> You never saw it coming <br> Except when you started running <br> And now you come undone (I, I, I) <br> Seen you fall, seen you crawl on you knees (eh, eh) <br> Seen you lost in a crowd, seen you colors fade <br> Wish I could make it better <br> Someday you won't remember <br> This pain you thought would last forever and ever <br> [Chorus 1] <br> There you stand, ten feet tall <br> I will say, ""I knew it all along"" <br> Your eyes are wider than distance <br> This life is sweeter than fiction <br> [Verse 2] <br> Just a shot, just a shot in the dark (oh, oh) <br> All you got, all you got are your shattered hopes <br> They never saw it coming <br> You hit the ground running <br> And now you're on to something <br> I, I, I say <br> What a sight, what a sight when the light came on <br> Put me right, threw me right when you put them front <br> And in this perfect weather <br> It's like we don't remember <br> The rain we thought would last forever and ever  <br>  <br>  <br>  <br> [Chorus 2] <br> There you stand, ten feet tall <br> I will say, ""I knew it all along"" <br> Your eyes are wider than distance <br> This life is sweeter than fiction <br> There you stand, next to me <br> All at once, the rest is history <br> Your eyes are wider than distance <br> This life is sweeter than fiction, fiction <br> [Bridge] <br> I'll be one of the many saying <br> Look at you now, look at you now, now <br> I'll be one of the many saying <br> You've made us proud, you've made us proud <br> I'll be one of the many saying <br> Look at you now, look at you now, now <br> I'll be one of the many saying <br> You've made us proud, you've made us proud, proud <br> And when they call your name <br> And they put your picture in a frame <br> You know that I'll be there time and again <br> Cause I loved you when <br> When you hit the ground, hit the ground, hit the ground, oh oh <br> Only sound, only sound that you hear is ""no"" <br> Now in this perfect weather <br> It's like we don't remember <br> The rain we thought would last forever and ever <br> [Chorus 2]"
Taylor Swift Mash-Up,"[Verse 1: Love Story] <br> We were both young when I first saw you <br> I close my eyes and the flashback starts <br> I'm standing there in the balcony in summer air <br> See the lights, see the party, the ball gowns <br> See you make your way through the crowd <br> And say, ""Hello"" <br> Little did I know <br> There I was Romeo, I was throwing pebbles <br> And your daddy said, ""Stay away from Juliet"" <br> I was crying on the staircase <br> Begging you, please don't go <br> [Verse 2: You Belong With Me] <br> 'Cause you belong with me <br> If you could see <br> That I'm the one who understands you <br> Been here all along <br> So why can't you see? <br> You belong with me <br> Standing by and waiting at your backdoor <br> All this time, how could you not know? <br> Baby, you belong with me <br> You belong with me <br> [Verse 3: Back To December] <br> So glad you made time to see me <br> How's life? Tell me how's your family <br> I haven't seen them in a while <br> You've been good, busier than ever <br> Small talk, work and the weather <br> Your guard is up and I know why <br> Because the last time you saw me <br> It's still burned in the back of your mind <br> You gave me roses and I left them there to die <br> So this is me swallowing my pride <br> Standing in front of you saying, ""I'm sorry for that night"" <br> I go back to December all the time <br> It turns out freedom ain't nothing but missing you <br> Wishing I'd realized what I had when you were mine  <br>  <br>  <br>  <br> I'd go back to December all the time <br> [Verse 4: Mean & Ours] <br> Someday, I'll be living in a big ol' city <br> And all you're ever gonna be is mean <br> Oh, someday, I'll be big enough so you can't hit me <br> And all you're ever gonna be is mean <br> Why you gotta be so mean? <br> Don't you worry your pretty little mind <br> People throw rocks at things that shine <br> And life makes love look hard <br> Why you gotta be so mean? <br> [Verse 5: Ours & We Are Never Ever getting Back Together] <br> The stakes are high, the waters rough <br> But this love is ours <br> We are never ever, ever getting back together <br> (This love is ours) <br> We are never ever, ever getting back together <br> (This love is ours) <br> [Verse 6: I Knew You Were Trouble & WANEGBT] <br> 'Cause I knew you were trouble when you walked in <br> We are never getting back together <br> Shame on me now <br> Flew me to places I'd never been <br> I knew you were trouble when you walked in <br> We are never ever, ever getting back together <br> Shame on me now <br> Flew me to places I'd never been <br> [Verse 7: Red & 22] <br> I'm feeling 22 <br> Losing her was blue like I'd never known <br> Missing her was dark grey all along <br> Forgetting her is like trying to know somebody you never met <br> Loving her was red, so red <br> Loving her was red, so red <br> Loving her was red, so red <br> Loving her was red, so red"
Taylor Swift Medley,"[Verse 1: AJ Rafael] <br> You were in college <br> Working part time waiting tables <br> Left a small town <br> Never look back <br> I was a flight risk with a fear of falling <br> Wondering why we bother with love <br> If it never lasts <br> [Pre-Chorus 1: Tori Kelly] <br> Cause' she wears short skirts, I wear T-shirts <br> She's cheer captain and I'm on the bleachers <br> Dreaming 'bout the day when <br> You wake up and find that <br> What you're looking for has been here the whole time <br> [Chorus] <br> Cause' all I know is we said, ""Hello"" <br> And your eyes look like coming home <br> All I know is a simple name <br> Everything has changed <br> All I know is you held the door <br> You'll be mine and I'll be yours <br> All I know since yesterday is everything has changed <br> [Verse 2] <br> If you could see that <br> I'm the one who understands you <br> Been here all along <br> So why can't you see <br> You belong with me? <br> [Verse 3] <br> Drop everything now!  <br>  <br>  <br>  <br> Meet me in the pouring rain <br> Kiss me on the sidewalk <br> Take away the pain <br> Cause' I see sparks fly whenever you smile <br> Get me with those green eyes, baby <br> As the lights go down <br> Give me something that'll haunt me <br> When you're not around <br> Cause' I see sparks fly whenever you smile <br> [Verse 4: 3x] <br> I just wanna know you better <br> Know you better <br> Know you better now <br> I just wanna know you, know you, know you <br> [Bridge] <br> We called it off again last night, but <br> This time I'm tellin' you <br> I'm tellin you <br> I knew you were trouble when you walked in <br> (We'll never, ever, ever) <br> I knew you were trouble when you walked in <br> (Getting back together) <br> You go talk to your friends <br> Talk to my friends <br> Talk to me, but <br> I knew you were trouble when you walked in <br> Never getting back together <br> [Outro] <br> But you are the best thing <br> That's ever been mine"
Taylor Swift Responds To Kanye's 'Famous' Lyric," <br>  <br>  <br>  <br> Search <br> Where is the video of Kanye telling me he was going to call me ‘that b**h' in his song? It doesn't exist because it never happened. You don't get to control someone's emotional response to being called ‘that b**h' in front of the entire world. Of course I wanted to like the song. I wanted to believe Kanye when he told me that I would love the song. I wanted us to have a friendly relationship. He promised to play the song for me, but he never did. While I wanted to be supportive of Kanye on the phone call, you cannot ‘approve' a song you haven't heard. Being falsely painted as a liar when I was never given the full story or played any part of the song is character a**a**ination. I would very much like to be excluded from this narrative, one that I have never asked to be a part of, since 2009."
Taylor Swift Tour Guide,"Fearless Tour <br> - Fearless Tour Setlist <br> - Fearless Tour Costumes <br> - ""You're Not Sorry/What Goes Around.../...Comes Around"" <br> Speak Now Tour <br> - Speak Now Tour Setlist <br> - Speak Now Tour Costumes <br> - ""Back To December/Apologize/You're Not Sorry"" <br> - ""Drops Of Jupiter (Cover)""  <br>  <br>  <br>  <br> - ""Bette Davis Eyes (Cover)"" <br> Red Tour <br> - Red Tour Setlist <br> - Red Tour Costumes <br> - ""Stay Stay Stay/Ho Hey"" <br> 1989 Tour <br> - 1989 Tour Setlist <br> - 1989 Tour Special Guests <br> - ""Wildest Dreams/Enchanted"" <br> Formula One Grand Prix <br> - Formula One Setlist"
"Taylor Swift's ""Shake It Off"" Video", <br>  <br>  <br>  <br> Ballet Break-Dancing Popping/Waving/Robot <br> Finger-Tutting Twerking Contemporary Cheerleading Ribbon-Dancing And her own styled one
TAYLOR vs. TREADMILL,"Open in gym. TAYLOR SWIFT is bopping her head. She puts her headphones in. TAYLOR: Man, I hate cardio. <br> TAYLOR opens Apple Music. <br> TAYLOR: Activity playlists, running...#GYMFLOW. Drake and Future. <br> ""Jumpman"" by Drake and Future starts playing. Taylor starts mouthing the words. She is running on a treadmill. <br> [Intro: Drake & Future & Taylor Swift] <br> If Young Metro don't trust you I'm gon' shoot you <br> Yeah, yeah <br> Halloween <br> I'm gon' shoot you <br> Yeah <br> TAYLOR starts rapping the song out loud. <br> [Verse 1: Drake & Taylor Swift] <br> Jumpman, Jumpman, Jumpman, them boys up to something <br> They just spent like two or three weeks out the country <br> Them boys up to something, they just not just bluffing <br> You don't have to call, I hit my dance like Usher, woo  <br>  <br>  <br>  <br> I just found my tempo like I'm DJ Mustard, woo <br> I hit that Ginobili with my left hand up like wo-- <br> TAYLOR falls face-first onto the treadmill while it is still running. It carries her off and throws her onto the floor, face down. Meanwhile, ""Jumpman"" is still playing. <br> [Verse 1 cont: Drake & Drake & Taylor Swift] <br> Lobster and Céline for all my babies that I miss <br> Chicken fingers, French fries for them that wanna diss Cut to black advertising screen. ""Jumpman"" is still playing, but it is just Drake rapping now. Distractingly good. All the music you want. Apple Music, get three months free now. <br> Sign-up required. Membership automatically renews monthly after trial."
Tell Me,"It was something like a perfect start to <br> This love yesterday but now who are you <br> I thought I knew <br> Your eyes know how to look right through me <br> It's like, you forgot the words you whispered to me <br> They weren't true <br> It's like it wasn't you <br> Could you tell me, what did i do <br> Because it can't be <br> We're already through <br> Did you sell me out for a fool <br> After you held me <br> Is that just what you do <br> What did you need from me <br> Tell me <br> Take time, to realise I know that <br> People change their minds <br> But that was something i wished you would say  <br>  <br>  <br>  <br> To my face <br> But you ran away <br> Could you tell me, what did i do <br> Because it can't be <br> We're already through <br> Did you sell me out for a fool <br> After you held me <br> Is that just what you do <br> What did you need from me <br> Tell me <br> If i had a reason <br> Or a simple goodbye <br> Baby even a lie <br> Yeah, yeah <br> Tell me, what did i do <br> Because baby <br> Suddenly we're already through <br> Did you sell me out for a fool <br> After you held me <br> Is that just what you do <br> What did you need from me <br> Tell me <br> And tell me <br> Oooh yeah <br> Tell me <br> Tell me"
Tell Me Why,"[Verse 1] <br> I took a chance <br> I took a shot <br> And you might think I'm bulletproof <br> But I'm not <br> You took a swing <br> I took it hard <br> And down here from the ground I see who you are <br> [Chorus] <br> I'm sick and tired of your attitude <br> I'm feeling like I don't know you <br> You tell me that you love me then you cut me down <br> And I need you like a heartbeat <br> But you know you got a mean streak <br> That makes me run for cover when you're around <br> And here's to you and your temper <br> Yes, I remember what you said last night <br> And I know that you see what you're doing to me <br> Tell me why <br> [Verse 2] <br> You could write a book on how to ruin someone's perfect day <br> Well I get so confused and frustrated <br> Forget what I'm trying to say, oh <br> [Chorus] <br> I'm sick and tired of your reasons <br> I got no one to believe in <br> You tell me that you want me, then push me around <br> And I need you like a heartbeat  <br>  <br>  <br>  <br> But you know you got a mean streak <br> That makes me run for cover when you're around <br> Here's to you and your temper <br> Yes, I remember what you said last night <br> And I know that you see what you're doing to me <br> Tell me why <br> [Verse 3] <br> Why do you have to make me feel small <br> So you can feel whole inside <br> Why do you have to put down my dreams <br> So you're the only thing on my mind <br> [Chorus] <br> I'm sick and tired of your attitude <br> I'm feeling like I don't know you <br> You tell me that you want me then cut me down <br> I'm sick and tired of your reasons <br> I've got no one to believe in <br> You ask me for my love then you push me around <br> Here's to you and your temper <br> Yes, I remember what you said last night <br> And I know that you see what you're doing to me <br> Tell me why <br> Why, tell me why <br> [Outro] <br> I take a step back, let you go <br> I told you I'm not bulletproof <br> Now you know"
Ten Dollars And A Six Pack,"[Verse 1] <br> You were what I wanted when I wanted what I just couldn't have <br> You were country loving really something for three months and a half <br> Everybody said that you were bad news <br> But baby I was betting on you <br> [Chorus] <br> So I guess I owe my friends ten dollars and a six pack <br> Got myself a big country serving to pay back <br> Now I'm going to have to listen to my mamma's ""I told you so"" <br> But you weren't even worth all that, ten dollars and a six pack <br> [Verse 2] <br> I said let them say we're crazy, you said let's go fishing a lot <br> The midnight moon was blazing baby, I was gazing into your eyes  <br>  <br>  <br>  <br> Everything changed when you took me to town <br> Caught you staring every other girl down <br> [Chorus] <br> [Bridge] <br> Can't believe the time you lost me <br> Can't believe what it cost me <br> [Verse 3] <br> Cause I owe my friends ten dollars and a six pack <br> Got myself a big old serving to pay back <br> I had to listen to my mamma's ""I told you so"" <br> You aren't never been through that <br> You aren't worth all that, ten dollars and a six pack <br> You aren't worth all that, ten dollars and a six pack"
That's The Way I Loved You,"He is sensible and so incredible <br> And all my single friends are jealous <br> He says everything I need to hear and it's like <br> I couldn't ask for anything better <br> He opens up my door and I get into his car <br> And he says you look beautiful tonight <br> And I feel perfectly fine But I miss screaming and fighting and kissing in the rain <br> And it's two a.m. and I'm cursing your name <br> You're so in love that you act insane <br> And that's the way I loved you <br> Breakin' down and coming undone <br> It's a roller coaster kinda rush <br> And I never knew I could feel that much <br> And that's the way I loved you He respects my space <br> And never makes me wait <br> And he calls exactly when he says he will <br> He's close to my mother <br> Talks business with my father <br> He's charming and endearing <br> And I'm comfortable But I miss screaming and fighting and kissing in the rain <br> And it's two a.m. and I'm cursing your name  <br>  <br>  <br>  <br> You're so in love that you act insane <br> And that's the way I loved you <br> Breakin' down and coming undone <br> It's a roller coaster kinda rush <br> And I never knew I could feel that much <br> And that's the way I loved you He can't see the smile I'm faking <br> And my heart's not breaking <br> Cause I'm not feeling anything at all <br> And you were wild and crazy <br> Just so frustrating intoxicating <br> Complicated, got away by some mistake and now I miss screaming and fighting and kissing in the rain <br> And it's two a.m. and I'm cursing your name <br> I'm so in love that I acted insane <br> And that's the way I loved you <br> Breakin' down and coming undone <br> It's a roller coaster kinda rush <br> And I never knew I could feel that much <br> And that's the way I loved you And that's the way I loved you oh, oh <br> Never knew I could feel that much <br> And that's the way I loved you"
That's What You Get,"[Verse 1: Hayley Williams] <br> No sir <br> Well, I don't wanna be the blame, not anymore <br> It's your turn <br> So take a seat we're settling the final score <br> And why do we like to hurt so much? <br> I can't decide <br> You have made it harder just to go on <br> And why? All the possibilities <br> Well, I was wrong <br> [Chorus 1: Hayley Williams with (Taylor Swift)] <br> That's what you get when you let your heart win, (woah) <br> That's what you get when you let your heart win, (woah) <br> I drowned out all my sense with the sound of its beating <br> And that's what you get when you let your heart win, (woah) <br> [Verse 2: Hayley Williams] <br> I wonder <br> How am I supposed to feel when you're not here? <br> Cause I burned every bridge I ever built when you were here <br> I still try holding onto silly things, I never learn <br> Oh, why? <br> All the possibilities <br> I'm sure you've heard <br> [Chorus: Taylor Swift with (Hayley Williams)]  <br>  <br>  <br>  <br> That's what you get when you let your heart win, (woah) <br> That's what you get when you let your heart win, (woah) <br> I drowned out all my sense with the sound of its beating <br> And that's what you get when you let your heart win, (woah) <br> [Bridge: Hayley Williams] <br> Pain, make your way to me, to me <br> And I'll always be just so inviting <br> If I ever start to think straight <br> This heart will start a riot in me <br> Let's start, start, hey! <br> [Breakdown: Taylor Swift and Hayley Williams] <br> Why do we like to hurt so much? <br> Oh, why do we like to hurt so much? <br> That's what you get when you let your heart win, woah <br> [Chorus: Hayley Williams and Taylor Swift] <br> That's what you get when you let your heart win, woah <br> That's what you get when you let your heart win, woah <br> Now, I can't trust myself with anything but this <br> And that's what you get when you let your heart win, woah"
