Song Title,Lyrics
ME!,"La traduction de ME! de Taylor Swift est disponible en bas de page juste après les paroles originales <br> [Taylor Swift] <br> I promise that you'll never find another like me <br> [Taylor Swift] <br> I know that I'm a handful, baby, uh <br> I know I never think before I jump <br> And you're the kind of guy the ladies want <br> (And there's a lot of cool chicks out there) <br> I know that I went psycho on the phone <br> I never leave well enough alone <br> And trouble's gonna follow where I go <br> (And there's a lot of cool chicks out there) <br> [ Taylor Swift] <br> But one of these things is not like the others <br> Like a rainbow with all of the colors <br> Baby doll, when it comes to a lover <br> I promise that you'll never find another like <br> [Taylor Swift] <br> Me-e-e, ooh-ooh-ooh-ooh <br> I'm the only one of me <br> Baby, that's the fun of me <br> Eeh-eeh-eeh, ooh-ooh-ooh-ooh <br> You're the only one of you <br> Baby, that's the fun of you <br> And I promise that nobody's gonna love you like me <br> [Brendon Urie & Taylor Swift] <br> I know I tend to make it about me <br> I know you never get just what you see <br> But I will never bore you, baby <br> (And there's a lot of lame guys out there) <br> And when we had that fight out in the rain <br> You ran after me and called my name <br> I never wanna see you walk away <br> (And there's a lot of lame guys out there) <br> [ Taylor Swift & Brendon Urie, Brendon Urie] <br> 'Cause one of these things is not like the others <br> Livin' in winter, I am your summer <br> Baby doll, when it comes to a lover <br> I promise that you'll never find another like <br> [Brendon Urie, Taylor Swift & Brendon Urie] <br> Me-e-e, ooh-ooh-ooh-ooh <br> I'm the only one of me <br> Let me keep you company <br> Eeh-eeh-eeh, ooh-ooh-ooh-ooh <br> You're the only one of you <br> Baby, that's the fun of you <br> And I promise that nobody's gonna love you like me <br> [ Brendon Urie, Taylor Swift & Both] <br> Hey, kids! <br> Spelling is fun! <br> Girl, there ain't no I in ""team"" <br> But you know there is a ""me"" <br> Strike the band up, 1, 2, 3 <br> I promise that you'll never find another like me <br> Girl, there ain't no I in ""team"" <br> But you know there is a ""me"" <br> And you can't spell ""awesome"" without ""me"" <br> I promise that you'll never find another like <br> [Both, Taylor Swift & Brendon Urie] <br> Me-e-e (Yeah), ooh-ooh-ooh-ooh (And I want ya, baby) <br> I'm the only one of me (I'm the only one of me) <br> Baby, that's the fun of me (Baby, that's the fun of me) <br> Eeh-eeh-eeh, ooh-ooh-ooh-ooh (Oh) <br> You're the only one of you (Oh) <br> Baby, that's the fun of you <br> And I promise that nobody's gonna love you like me <br> [ Brendon Urie, Taylor Swift & Both] <br> Girl, there ain't no I in ""team"" <br> But you know there is a ""me"" <br> I'm the only one of me (Oh-oh) <br> Baby, that's the fun of me <br> Strike the band up, 1, 2, 3 <br> You can't spell ""awesome"" without ""me"" <br> You're the only one of you <br> Baby, that's the fun of you <br> And I promise that nobody's gonna love you like me <br> Traduction ME! - Taylor Swift <br> [Taylor Swift] <br> Je te promets que tu ne trouveras jamais une autre fille comme moi <br> [Taylor Swift] <br> Je sais que je suis pénible, bébé, uh  <br>  <br>  <br>  <br> Je sais que je ne réfléchis jamais avant de sauter <br> Et tu es le genre de gars que les femmes adorent <br> (Et il y a beaucoup de filles super ici) <br> Je sais que je suis devenu psychopathe au téléphone <br> Je ne pars jamais a**ez bien seul <br> Et les ennuis vont suivre où je vais <br> (Et il y a beaucoup de poussins cool là-bas) <br> [Taylor Swift] <br> Mais l'une de ces choses-là ne ressemble à aucune autre <br> Comme un arc-en-ciel vêtu de toutes ses couleurs <br> Oh, bébé, en matière d’amour <br> Je te promets que tu ne trouveras jamais une autre fille comme <br> [Taylor Swift] <br> Mooooi, ooh-ooh-ooh-ooh <br> Je suis unique en mon genre <br> Bébé, c’est ça qui est bon avec moi <br> Eeh-eeh-eeh, ooh-ooh-ooh-ooh <br> Tu es unique en ton genre <br> Bébé, c’est ça qui est bon avec toi <br> Et je te promets que personne ne t’aimera autant que moi <br> [Brendon Urie & Taylor Swift] <br> Je sais que j'ai tendance à accaparer l’attention <br> Je sais que les choses sont plus compliquées qu’il n’y parait <br> Mais je ne t'ennuierai jamais, bébé <br> (Et il y a beaucoup de pauvres mecs ici) <br> Et quand on s’est disputé sous la pluie <br> Tu m’as rattrapé en courant, en criant mon nom <br> Je ne veux plus jamais te voir t’en aller <br> (Et il y a beaucoup de pauvres mecs ici) <br> [Taylor Swift & Brendon Urie, Brendon Urie] <br> Car l'une de ces choses-là ne ressemble à aucune autre <br> Si l’hiver est ton quotidien, je serai ton été <br> Oh, bébé, en matière d’amour <br> Je te promets que tu ne trouveras jamais une autre fille comme <br> [Brendon Urie, Taylor Swift & Brendon Urie] <br> Mooooi, ooh-ooh-ooh-ooh <br> Je suis unique en mon genre <br> Laisse-moi te tenir compagnie <br> Eeh-eeh-eeh, ooh-ooh-ooh-ooh <br> Tu es unique en ton genre <br> Bébé, c’est ça qui est bon avec toi <br> Et je te promets que personne ne t’aimera autant que moi <br> [Brendon Urie, Taylor Swift et les deux] <br> Hé, les enfants ! <br> C’est amusant d’épeler les mots ! <br> Girl, il n'y a pas non « je » dans une « équipe » <br> Mais tu sais qu'il y a un « qui » <br> C’est parti, 1, 2, 3 <br> Je te promets que tu ne trouveras jamais une autre fille comme moi <br> Girl, il n'y a pas non « je » dans une « équipe » <br> Mais tu sais qu'il y a un « qui » <br> Et il y a un « j’ai » dans « génial » <br> Je te promets que tu ne trouveras jamais une autre fille comme <br> [Taylor Swift et Brendon Urie] <br> Mooooi (Ouais), ooh-ooh-ooh-ooh (Et c’est toi que je veux, bébé) <br> Je suis unique en mon genre (Je suis unique en mon genre) <br> Bébé, c’est ça qui est bon avec moi (Bébé, c’est ça qui est bon avec moi) <br> Eeh-eeh-eeh, ooh-ooh-ooh-ooh (Oh) <br> Tu es unique en ton genre (Oh) <br> Bébé, c’est ça qui est bon avec toi <br> Et je te promets que personne ne t’aimera autant que moi <br> [Brendon Urie, Taylor Swift et les deux] <br> Girl, il n'y a pas non « je » dans une « équipe » <br> Mais tu sais qu'il y a un « qui » <br> Je suis unique en mon genre (Oh-oh) <br> Bébé, c’est ça qui est bon avec moi <br> C’est parti, 1, 2, 3 <br> Et il y a un « j’ai » dans « génial » <br> Tu es unique en ton genre <br> Bébé, c’est ça qui est bon avec toi <br> Et je te promets que personne ne t’aimera autant que moi"
Mean,"[Verse 1] <br> You, with your words like knives <br> And swords and weapons that you use against me <br> You have knocked me off my feet again <br> Got me feeling like I'm nothing <br> You, with your voice like nails on a chalkboard <br> Calling me out when I'm wounded <br> You, picking on the weaker man <br> [Pre-Chorus 1] <br> But you can take me down with just one single blow <br> But you don't know what you don't know <br> [Chorus] <br> Someday, I'll be living in a big old city <br> And all you're ever gonna be is mean <br> Someday, I'll be big enough so you can't hit me <br> And all you're ever gonna be is mean <br> Why you gotta be so mean? <br> [Verse 2] <br> You, with your switching sides <br> And your wildfire lies and your humiliation <br> You have pointed out my flaws again <br> As if I don't already see them <br> I walk with my head down, trying to block you out <br> Cause I'll never impress you <br> I just want to feel okay again <br> [Pre-Chorus 2] <br> I'll bet you got pushed around <br> Somebody made you cold <br> But the cycle ends right now <br> Cause you can't lead me down that road  <br>  <br>  <br>  <br> And you don't know what you don't know <br> [Chorus] <br> [Bridge] <br> And I can see you years from now in a bar <br> Talking over a football game <br> With that same big loud opinion <br> But nobody's listening <br> Washed up and ranting about the same old bitter things <br> Drunk and grumbling on about how I can't sing <br> But all you are is mean <br> [Interlude] <br> All you are is mean <br> And a liar, and pathetic, and alone in life <br> And mean, and mean, and mean, and mean <br> But someday I'll be living in a big old city <br> And all you're ever going to be is mean, yeah! <br> [Chorus 2] <br> Someday, I'll be big enough so you can't hit me <br> And all you're ever going to be is mean <br> Why you gotta be so mean? <br> Someday, I'll be living in a big old city <br> (Why you gotta be so mean?) <br> And all you're ever gonna be is mean <br> (Why you gotta be so mean?) <br> Someday, I'll be big enough so you can't hit me <br> (Why you gotta be so mean?) <br> And all you're ever gonna be is mean <br> Why you gotta be so mean?"
Message In A Bottle (Taylor’s Version) [From The Vault],"[Verse 1] <br> I know that you like me <br> And it's kinda frightenin' standin' here waitin', waitin' <br> And I became hypnotized by freckles and bright eyes, tongue-tied <br> [Pre-Chorus] <br> But now you're so far away and I'm down <br> Feelin' like a face in the crowd <br> I'm reachin' for you, terrified <br> [Chorus] <br> 'Cause you could be the one that I love <br> I could be the one that you dream of <br> A message in a bottle is all I can do <br> Standin' here, hopin' it gets to you <br> You could be the one that I keep, and I <br> I could be the reason you can't sleep at night <br> A mеssage in a bottle is all I can do <br> Standin' herе, hopin' it gets to you <br> [Verse 2] <br> These days I'm restless <br> Workdays are endless, look how you made me, made me <br> But time moves faster, replaying your laughter, disaster <br> [Pre-Chorus] <br> 'Cause now you're so far away and I'm down <br> Feelin' like a face in the crowd <br> I'm reachin' for you, terrified, 'cause <br> [Chorus] <br> 'Cause you could be the one that I love <br> I could be the one that you dream of <br> A message in a bottle is all I can do <br>  <br>  <br>  <br> Standin' here, hopin' it gets to you (It gets to you) <br> You could be the one that I keep, and I (I) <br> I could be the reason you can't sleep at night (At night) <br> A message in a bottle is all I can do <br> Standin' here, hopin' it gets to you <br> [Bridge] <br> How is it in London? (London) <br> Where were you while I'm wondering (Wondering) <br> If I'll ever see you again? <br> You could be the one that I love, mm-mm <br> And now I'm standin' here, hopin' it gets to you <br> [Chorus] <br> 'Cause you could be the one that I love (Yeah, yeah) <br> I could be the one that you dream of <br> A message in a bottle is all I can do <br> Standin' here, hopin' it gets to you (It gets to you) <br> You could be the one that I keep, and I <br> I could be the reason you can't sleep at night (You can't sleep at night) <br> A message in a bottle is all I can do (Yeah, yeah) <br> Standin' here, hopin' it gets to you (Yeah, yeah) <br> [Outro] <br> You could be the one that I love <br> You could be the one that I love, I love <br> And now I'm standin' here, hopin' this gets to you"
Mine,"[Verse 1] <br> You were in college, working part-time, waiting tables <br> Left a small town and never looked back <br> I was a flight risk, with a fear of falling <br> Wondering why we bother with love, if it never lasts <br> [Pre-Chorus 1] <br> I say, ""Can you believe it?"" <br> As we're lying on the couch <br> The moment, I could see it <br> Yes, yes, I can see it now <br> [Chorus] <br> Do you remember, we were sitting there, by the water? <br> You put your arm around me for the first time <br> You made a rebel of a careless man's careful daughter <br> You are the best thing that's ever been mine <br> [Verse 2] <br> Flash forward, and we're taking on the world together <br> And there's a drawer of my things at your place <br> You learn my secrets and figure out why I'm guarded <br> You say we'll never make my parents' mistakes <br> [Pre-Chorus 2] <br> But we got bills to pay <br> We got nothing figured out <br> When it was hard to take <br> Yes, yes <br> This is what I thought about: <br> [Chorus] <br> Do you remember, we were sitting there, by the water? <br> You put your arm around me for the first time <br> You made a rebel of a careless man's careful daughter  <br>  <br>  <br>  <br> You are the best thing that's ever been mine <br> Do you remember all the city lights on the water? <br> You saw me start to believe for the first time <br> You made a rebel of a careless man's careful daughter <br> You are the best thing that's ever been mine <br> [Bridge] <br> And I remember that fight, 2:30 AM <br> As everything was slipping right out of our hands <br> I ran out, crying, and you followed me out into the street <br> Braced myself for the goodbye <br> Cause that's all I've ever known <br> Then, you took me by surprise <br> You said, ""I'll never leave you alone."" <br> [Chorus 2] <br> You said, ""I remember how we felt, sitting by the water <br> And every time I look at you, it's like the first time <br> I fell in love with a careless man's careful daughter <br> She is the best thing that's ever been mine."" <br> Hold on, make it last <br> Hold on, never turn back <br> You made a rebel of a careless man's careful daughter <br> You are the best thing that's ever been mine <br> [Outro] <br> Yeah, yeah <br> Do you believe it? <br> (Hold on) <br> We're gonna make it now <br> (Hold on) <br> And I can see it <br> Yeah, yeah <br> I can see it now (see it now)"
Mistake,"I like glitter <br> And sparkly dresses <br> But I'm not gonna talk about that <br> In my monologue I like baking <br> And things that smell like winter <br> But I'm not gonna talk about that <br> In my monologue <br> Lalala Lalala I like writing songs about <br> Douche bags who cheat on me <br> But I'm not gonna say that <br> In my monologue I like writing their names in the <br> songs <br> So they're ashamed to go out in <br> public <br> But I'm not gonna say that <br> In my monologue Lala Lalalalala <br> This is <br> My musical monologue You might think I'd bring up Joe <br> That guy who broke up with me on <br> the phone <br> But I'm not gonna mention him <br> In my monologue ""Hey Joe! I'm doing real well! <br> Tonight I'm hosting SNL"" <br> [ From: http://www.elyrics.net/  <br>  <br>  <br>  <br> read/t/taylor-swift-lyrics/ <br> monologue-song-(lalala)- <br> lyrics.html ] But I'm not gonna brag about that <br> In my monologue Lalala Hahaha Hahaha Hahaha <br> Lalala And if your wondering if I might <br> Be dating the werewolf from <br> Twilight <br> *Hi Taylor* <br> I'm not gonna comment on that <br> In my monologue Lala Lalalalala <br> This is <br> My musical monologue *looks around stage* You might be expecting me to say <br> Something bad about Kanye <br> And how he ran up on the stage <br> And ruined my VMA monologue <br> *sigh* But there's nothing more to say <br> Cuz' everything's okay. <br> I've got security lining the stage! It's my SNL monologue Lala Lalalalala <br> This is <br> My SNL monologue <br> Lala Lalalalala That was my SNL monologue pig pig"
Monologue Song (La La La),"[Verse 1] <br> I like glitter and sparkly dresses <br> But I'm not going to talk about that <br> In my monologue <br> I like baking and things that smell like winter <br> But I'm not going to talk about that <br> In my monologue <br> [Chorus] <br> La la la, la la la <br> [Verse 2] <br> I like writing songs about douche bags who cheat on me <br> But I'm not going to say that <br> In my monologue <br> I like writing their names into songs so they're ashamed to go in public <br> But I'm not going to say that <br> In my monologue <br> [Chorus] <br> La la, la la la la la <br> This is my musical monologue <br> [Verse 3] <br> You might think I'd bring up Joe <br> The guy who broke up with me on the phone <br> But I'm not going to mention him <br> In my monologue <br> Hey Joe! I'm doing real well <br> Tonight I'm hosting SNL  <br>  <br>  <br>  <br> But I'm not going to brag about that <br> In my monologue <br> [Chorus] <br> La la la, ha ha ha <br> Ha ha ha, ha ha ha <br> La la la <br> [Verse 4] <br> And if you're wondering if I might <br> Be dating the werewolf from Twilight <br> [mouths ""Hi Taylor!"", blows him a kiss] <br> I'm not going to comment on that <br> In my monologue <br> [Chorus] <br> La la, la la la la la <br> This is my musical monologue <br> [Verse 5] <br> You might be expecting me to say <br> Something bad about Kanye <br> And how he ran up on the stage <br> And ruined my VMA monologue <br> But there's nothing more to say <br> Cause everything's okay <br> I've got security lining this stage <br> This is my SNL monologue <br> [Chorus] <br> La la, la la la la la <br> This is my SNL monologue <br> La la, la la la la la <br> That was my SNL monologue"
Mr perfectly fine,"But that was when I got to know Mr. “Change of heart” <br> Mr. “Leaves me all alone,” I fall apart <br> It takes everything in me just to get up each day <br> But it’s wonderful to see that you’re okay <br> Hello Mr. “Perfectly fine” <br> How’s your heart after breaking mine? <br> Mr. “Always at the right place at the right time,” baby <br> Hello Mr. “Casually cruel” <br> Mr. “Everything revolves around you” <br> I’ve been Miss “Misery” since your goodbye <br> And you’re Mr. “Perfectly fine” <br> Mr. “Never told me why” <br> Mr. “Never had to see me cry” <br> Mr. “Insincere apology so he doesn’t look like the bad guy” <br> He goes about his day <br> Forgets he ever even heard my name <br> Well, I thought you might be different than the rest, I guess you’re all the same <br> ‘Cause I hear he’s got his arm ’round a brand-new girl <br> I’ve been pickin’ up my heart, he’s been pickin’ up her <br> And I never got past what you put me through <br> But it’s wonderful to see that it never fazed you <br> Hello Mr. “Perfectly fine” <br> How’s your heart after breakin’ mine? <br> Mr. “Always at the right place at the right time,” baby  <br>  <br>  <br>  <br> Hello Mr. “Casually cruel” <br> Mr. “Everything revolves around you” <br> I’ve been Miss “Misery” since your goodbye <br> And you’re Mr. “Perfectly fine” <br> So dignified in your well-pressed suit <br> So strategized, all the eyes on you <br> Sashay away to your seat <br> Versuri-lyrics.info <br> It’s the best seat, in the best room <br> Oh, he’s so smug, Mr. “Always wins” <br> So far above me in every sense <br> So far above feeling anything <br> And it’s really such a shame <br> It’s such a shame <br> ‘Cause I was Miss “Here to stay” <br> Now I’m Miss “Gonna be alright someday” <br> And someday maybe you’ll miss me <br> But by then, you’ll be Mr. “Too late” <br> Goodbye Mr. “Perfectly fine” <br> How’s your heart after breakin’ mine? <br> Mr. “Always at the right place at the right time,” baby <br> Goodbye Mr. “Casually cruel” <br> Mr. “Everything revolves around you” <br> I’ve been Miss “Misery” for the last time <br> And you’re Mr. “Perfectly fine” <br> You’re perfectly fine <br> Mr. “Look me in the eye and told me you would never go away” <br> You said you’d never go away"
Mr. Perfectly Fine (Taylor’s Version) [From the Vault],"[Verse 1] <br> Mr. ""Perfect face"" <br> Mr. ""Here to stay"" <br> Mr. ""Looked me in the eye and told me you would never go away"" <br> Everything was right <br> Mr. ""I've been waitin' for you all my life"" <br> Mr. ""Every single day until the end, I will be by your side"" <br> [Pre-Chorus] <br> But that was when I got to know Mr. ""Change of heart"" <br> Mr. ""Leaves me all alone,"" I fall apart <br> It takes everything in me just to get up each day <br> But it's wonderful to see that you're okay <br> [Chorus] <br> Hello, Mr. ""Perfectly fine"" <br> How's your heart after breakin' mine? <br> Mr. ""Always at the right place at the right time,"" baby <br> Hello, Mr. ""Casually cruel"" <br> Mr. ""Everything revolves around you"" <br> I've been Miss Misery since your goodbye <br> And you're Mr. ""Perfectly fine"" <br> [Verse 2] <br> Mr. ""Never told me why"" <br> Mr. ""Never had to see me cry"" <br> Mr. ""Insincere apology so he doesn't look like the bad guy"" <br> He goes about his day <br> Forgets he ever even heard my name <br> Well, I thought you might be different than the rest, I guess you're all the same <br> [Pre-Chorus] <br> 'Cause I hear he's got his arm 'round a brand-new girl <br> I've been pickin' up my heart, he's been pickin' up her <br> And I never got past what you put me through <br> But it's wonderful to see that it never phased you <br>  <br>  <br>  <br> [Chorus] <br> Hello, Mr. ""Perfectly fine"" <br> How's your heart after breakin' mine? <br> Mr. ""Always at the right place at the right time,"" baby <br> Hello, Mr. ""Casually cruel"" <br> Mr. ""Everything revolves around you"" <br> I've been Miss Misery since your goodbye <br> And you're Mr. ""Perfectly fine"" <br> [Verse 3] <br> So dignified in your well-pressed suit <br> So strategized, all the eyes on you <br> Sashay your way to your seat <br> It's the best seat, in the best room <br> Oh, he's so smug, Mr. ""Always wins"" <br> So far above me in every sense <br> So far above feeling anything <br> [Bridge] <br> And it's really such a shame <br> It's such a shame <br> 'Cause I was Miss ""Here to stay"" <br> Now I'm Miss ""Gonna be alright someday"" <br> And someday maybe you'll miss me <br> But by then, you'll be Mr. ""Too late"" <br> [Chorus] <br> Goodbye, Mr. ""Perfectly fine"" <br> How's your heart after breakin' mine? <br> Mr. ""Always at the right place at the right time,"" baby <br> Goodbye, Mr. ""Casually cruel"" <br> Mr. ""Everything revolves around you"" <br> I've been Miss Misery for the last time <br> And you're Mr. ""Perfectly fine"" <br> [Outro] <br> You're perfectly fine <br> Mr. ""Looked me in the eye and told me you would never go away"" <br> You said you'd never go away"
