Song Title,Lyrics
Nightmare,"[Intro] <br> So, you tell me that everything just isn't going well <br> Well, first off <br> [Verse 1] <br> My only problem is d**h <br> f** heaven, I ain't showing no religion respect <br> Brain damage, therapy's the only thing I regret <br> Talking to me is like a f**ing body missing her neck <br> But, I'm surprised I ain't pop off my top off <br> Life is a b**h and my co*k's soft, the Glock's co*ked <br> My hands trembled, my finger's slipped, the wall's red <br> Her life is f**ed, she sad now, her son is dead <br> [Hook] <br> I told her I'm her worst nightmare <br> This is hell, you don't ever gotta fight fair <br> My spirit floats around in the night air <br> Or in your day dreams, that's how d**h seems <br> [Verse 2] <br> When I was younger, I would smile a lot <br> I'm getting older, getting bolder but a wiser top <br> Now I'm drunk driving, lap's full of the Budweiser tops <br> Life is a movie and you're just a prop <br> They begged me to stop but I listen like d**h drones <br> Love? I don't get none, that's why I'm so hostile to the kids that get some <br> My father called me to tell me he loved me <br> I'd have a better chance of getting Taylor Swift to f** me <br> Annoying and I'm ugly, most n***as wanna punch me <br> I'm surprised the f**ing doctor even touched me <br> Feel like Humpty, you hoping that I'll fall? f** y'all <br> I'm Ace, I'm parentless, I'm kinda arrogant <br> Ignorant as f**, defend people for the hell of it <br> Because I am the devil, f**er get on my level <br> Doughnuts and keys and kick-flips, Supremes and markers <br> My life is Ms. Mo Unique Parker, but a little darker, I'll see you in a couple <br> [Hook] <br> [Interlude] <br> Tyler, here's some water man <br> You seem a little tense.. how is Thebe? <br> [Verse 3] <br> All because a n***a just don't give a f** <br> Parents wanna blame me all because their kid is f**ing up <br> But f** that, you're sh**ty parents, face it, s** it up <br> That's what you shoulda did before that n***a bust, huh <br> Feel like I missed my little brother growing up <br> Feel like my little brother missed his brother growing up <br> But this is Golf Wang, like he missed his family growing up <br> I got a little taller since the last time you seen me, bro <br> Now I'm emo, so f** it, I'm pouring up <br> But I never had a drink, ""Sydney, Tyler's throwing up!"" <br> My n***a Jasper said if I drink and get drunk enough <br> I won't feel the feeling I be feeling when I'm sobered up <br> But that's a f**ing lie, why would he say that I'm <br> As emotionally strained as Travis when he's.. (Tyler, calm down)  <br>  <br>  <br>  <br> Don't look at me, I'm 6'5"" about to f**ing cry <br> About another guy, but this is Golf Wang, do or die <br> I finally had a family <br> Domo's in another state, where the f** is Riley? <br> Now you n***as wanna be nice because the labels wanna sign me <br> But before the co-signing and you f**ers couldn't find me? <br> f** that! I hope you die in a fiery d**h <br> One ear I got kids screaming ""O.F. is the best"" <br> The other ear I got Tron Cat asking where the bullets and the bombs at <br> So I can k** these levels of stress, sh** <br> They say that I'm shock value <br> How about you hop off co*k and turn volume down? <br> I haven't got around to telling my mom sh** <br> Cause I don't know how to.. (Whoa) <br> All I want is her support, whenever the fight's at home <br> When mommy cusses out cousin, some knifes get shown <br> Now she's really f**in' pissed, so the knives get thrown <br> And hit her in her f**ing neck, now her throat's all gone <br> Looking like a f**ing monster from the Twilight Zone <br> Then they wonder why I stay at Travis pad with a backpack <br> For the whole week full of plastic-wrapped black tees <br> And deodorant like this house is my home <br> I could live with the same hat <br> And the same flat-screen TV watching Flapjack <br> And the same bacon and waffles on a nice Saturday <br> Where I skate with the same f**ing friends at <br> Didn't give a f** about fame or a name, oh <br> ""Message from GZA, oh, another one from Plain Pat"" <br> Email full of emails, I never write back <br> Ain't k** myself yet, now I already want my life back <br> [Hook] <br> [Verse 4] <br> One shot, two shots, one gun, two cops <br> I'm blowin' them flu shots, couldn't k** me with two top rockers <br> You're on the side of f*ggots and co*k blockers <br> I'm on the side of bad-a** kids and the top notches <br> I'm Barney, dinosaur Harley of a human <br> Cause I'm shrooming with the bangers and the carneys <br> You n***as can't harm me cause you all know that <br> We at the f**in' dirty lifer's laundry (Tyler, calm down) n***a get off me <br> [Outro] <br> f** off me man, f** (What's got into you?) <br> I don't know, it's like I'm a different person at times <br> Sometimes I'm f**ing mad, sometimes I'm not (Yeah, you..) <br> As though I got a f**ing voice in my head <br> Telling me to do all this f**ed up sh**, man (Yeah, what's this?) <br> I don't f**ing know, man (What's this person named then, Tyler, huh?) <br> He tells me to do this sh** that I don't wanna f**ing do (What's his name?) <br> Tron Cat"
NOIZE,"[Jaden:] <br> Yeah, I'ma need that gold medal, matte black sh*t on a whip <br> Hear them drums, ni**a? ERYS in a 6 with the wrist <br> 'Bout to swish, no assist, never miss with the drip <br> Man, I'm 'bout to go and do some sh*t that no one ever did <br> I'm with the boys, making the noise <br> This is the uh, Tesla toy <br> We stackin' the toys, end of the story <br> We already gone, that's more to the point <br> ni**as ignored us, flyin' it solo <br> Gone in the mornin', you never know it <br> I'm unemployed and I'm on the block <br> Now we 'bout to blow up, now we 'bout to blow it <br> We the rascal, dead cam, punk kids <br> Runnin' through the club, where the music hella pumpin' <br> You don't want sh*t <br> Tell them ni**as start jumpin' <br> At a warehouse party with the fu*k sh*t <br> And pull up with the bass, made the sh*t sound rustic <br> Mace to the face, riot gear's in the closet <br> Keep the city sane, keep the babies out the moshpits <br> Keep me out the party, 'cause I'm too psychotic, yeah <br> (I'm with the boys, making the noise) <br> Tell me you're sorry, I feel the same <br> (I'm with the boys, making the noise) <br> You gave me DMT, straight from your brain, girl <br> (I'm with the boys, making the noise) <br> We weren't in nature to marry again <br> (I'm with the boys, making the noise) <br> That's why it all feels like it's just the same <br> On a roll <br> When we pull up with the gold <br> Ready to go, ready to go <br> Ready to go, ready to go <br> We don't flex most trap sh*t <br> Bass with the backflip <br> Scrape metal on the pavement, fu*k fashion away <br> Everyday, motivate, turn the masses, the bull-ass-sh*t <br> ni**a, this sh*t's a classic <br> Woah (Woah) <br> (I'm with the boys, making the noise) <br> Tell me you're sorry, I feel the same <br> (I'm with the boys, making the noise) <br> You gave me DMT, straight from your brain, girl <br> (I'm with the boys, making the noise) <br> We weren't in nature to⁠—  <br>  <br>  <br>  <br> Jaden'll flash, man, okay <br> Man I'm back in this sh*t, and I'm rappin' <br> Today, pushin' packs on the corner, countin' stacks <br> Everyday got the wings in the Hills, like it's Batman, okay <br> fu*kboys need to stop fu*kin' rappin', okay <br> [Jaden & (Tyler, The Creator):] <br> Tell me you're sorry, I feel the same <br> (I'm with the boys, making the noise) <br> You gave me DMT, straight from your brain, girl <br> (I'm with the boys, making the noise) <br> We weren't in nature, to marry again <br> (I'm with the boys, making the noise) <br> That's why it all feels like it's just the same (Ayo, Ayo) <br> [Tyler, The Creator:] <br> Jaden, they think we fu*kin', kissin', lickin' and su*kin' <br> What they don't get, sarcasm, let's end it like orgasm <br> I'm a nutcase baby, put a lock on that b*tch <br> You thinkin' I'm diggin' graves <br> The way I'm puttin' rocks on my wrist? (No) <br> Young T-man, taller when you see him (Woo) <br> I'm all about them fruits and my greens like a vegan (Wow, wow) <br> Your talent couldn't put you in the spot where ni**as be in <br> When I get that 20 bag, I swear to God that I'll be leavin' (Nyoom) <br> I might buy vanilla waf', I might buy some real estate <br> I might buy Canary, taxi yellow, diamond glitter flick <br> I might blow it all on somethin' stupid, wouldn't matter <br> 'Cause I did not sign a dummy fu*kin' deal <br> Like them, at end of day <br> Got my white stripes, this my icky thump <br> Got my heart broke, won't you pick it up? <br> Needed time to heal, just like Nicki Buns <br> b*tch I make it hard to breathe, like, b*tch, I kick the lung <br> [Jaden:] <br> Let's go, let's go <br> ERYS is on your side <br> I didn't wanna die for you <br> Girl I had to try <br> I really wanna fly with you <br> Sunset on our lives <br> I really wanna try <br> You been by my⁠— <br> Ooh, yeah, yeah, yeah, yeah <br> Ooh, yeah, yeah, yeah, yeah, yeah <br> Let's go"
November,"[Intro] <br> Say some more, never want to talk about it <br> Feel a way, woah <br> Feel a way, woah <br> Feel a way, woah <br> [Hook] <br> Take me back to November <br> Take me back to November <br> Hawaiian shirts in the winter, cold water, cold water <br> Yeah, take me back to November, wa**up <br> Can we go back to November? <br> Take me back to November <br> Hawaiian shirts in the winter, deep thoughts, deep thoughts <br> Naw, take me back to November, wa**up <br> [Verse 1] <br> What if Clancy f**in' me over? <br> What if 'Who Dat Boy' is rhetorical and this sh** is over? <br> What if I'm hustling backwards? <br> What if my accountant ain't payin' my taxes? <br> Fillin' his pockets and IRS show up asking me questions <br> I couldn't answer 'cause I was too busy tryna make cla**ics <br> Boy ain't got no motherf**ing cla**ics <br> What if my music too weird for the ma**es? <br> And I'm only known for tweets more than beats or <br> All my day ones turn to three, fours cause of track seven <br> f**, what if I get stuck? <br> What if I got comfortable? I gotta keep it buck fifty <br> What if I lost it all and ended up back in Ladera <br> At them sh**ty apartments that's across the Bank of America <br> Damn, I would be hurtin' <br> Writing all of these songs cause Wi-Fi wasn't working <br> Last year in total, I put out two verses <br> But five seven figures since then, life's kinda perfect <br> Oh is it really? Oh is it really? b**h you know the dealy <br> Really hilly willy tilly silly, hold that billy how I Milly Rock <br> When they can't relate him, when they start to hate him <br> They don't drive these cars so whats they ultimatum? <br> Tell me, what's your November? Is it a person? <br> Mine was the summer '06, I remember the (*horn*) <br> What if I thought the brake was the gas? What if I crashed? <br> What if these deep thoughts was my last? <br> Let me pull over, quick! <br> [Hook] <br> And drive back to November <br> Take me back to November  <br>  <br>  <br>  <br> Hawaiian shirts in the Winter, cold water, cold water <br> Yeah, take me back to November, wa**up <br> Can we go back to November? <br> Take me back to November <br> Hawaiian shirts in the Winter, deep thoughts, deep thoughts <br> Naw, take me back to November, wa**up <br> [Interlude: scattered voices] <br> My November was those Odd Future Sundays, where we used to just skate all day <br> My November was performing with Lil Wayne <br> My November was awesome, I booked my first feature film <br> My November was when my brother took me to first concert ever... <br> My November was summer 2015 when I fell in love with someone who f**ed my whole world up, showed me life through a different <br> 2014 Miami 43rd Street, everyday was November <br> [Bridge] <br> Take me back, take me back <br> Take me back, take me back <br> Take me back, take me back, take me back <br> Take me back, take me back <br> Take me back, take me back <br> Take me back, take me back <br> Take me back, take me back, take me back <br> Take me back, take me back <br> I ain't doin' fine, lost my mothaf**in' mind <br> Time travel back and help me find <br> Take me back, take me back to November, this I know <br> Take me back, take me back <br> Take me back, take me back to November, this I know <br> ""My November is right now"" <br> [Verse 2] <br> I wrote a song about you, I want your opinion <br> I consider my heart rate has slowed down at the ending <br> Cause the love I got for you has exceeded appearance, the lyrics <br> Matter of fact, I'mma just call you, so you can hear it <br> If you do answer, I play it to state facts <br> Although I already know the response you gon' say back <br> At that point I'll hang up, disappear and just stay back <br> And if you don't I'll leave a voicemail with the playback <br> [Outro] <br> Hello, no one is available to take your call <br> Please leave a message after the tone <br> *beep*"
Odd Toddlers,"Hello, the Hype is so Mellow <br> b**h I'm dope and my pipe is so yellow <br> The blue polka dots, pink stripes and it's pink on the title <br> n***a f** your role model b**h, I'm my own idol and <br> If you can't face it my n***a, you can a** it <br> My accessorize accessories bring out my a**ets <br> n***a they sound on acid, tablets <br> Stussy's G-Shock with my custom pair of 3D gla**es <br> I suffer from ADHD <br> I should win a f**in' award for bein' me <br> Beat bangin' the tom-toms <br> My producer selection is fresh n***a, f** Vons <br> Ace the Underdog, thrown 'em on the back bender <br> Cause I change my outfit more than transs**uals change gender <br> Eating Belgium waffles with Italian biscotts <br> I sold my soul to the devil for thirty percent off <br> And to you emo kids who walk around pissed off <br> Step one: pull your panties down and start to piss off <br> Step two: run to your radio, turn this sh** off <br> n***a didn't bother, so my father didn't help  <br>  <br>  <br>  <br> So when my mom would beat my a**, she would always hit me <br> With Gucci belts, Gucci imprint from leather welts <br> I'm so dapper man, funky fresh dapper dan <br> I'm your favorite rapper fan, it's an honor to shake my hand <br> On the wall, tall on excursions, I'm a virgin of swap meets <br> I'm so pure, so sick it's no cure <br> I'm dope, where the fiends at? Aight, where the jeans at? <br> They had the cooler t-shirt at Supreme <br> And they see me they play pictionary <br> I got a good way with words like a dictionary <br> And in that dictionary my name is Bob Fresh <br> They at the same spot they making no progress <br> Becoming a good rapper ain't that easy <br> Of a process, eargasms they have 'em <br> The hotels we stayin' in twelve star <br> Tyler say ""Yo Casey just write a twelve bar"" <br> If I'm with twelve people, I'm with twelve stars <br> You haters what up, you Gods <br> They against us, oh no <br> Red and white diamonds, Supreme box logo"
"OKAGA, CA","[Verse 1 - Tyler, The Creator:] <br> Let's just run away from here (cause it's not, cause it's not) <br> Working out on Earth, my dear (cause It's not, cause it's not) <br> What you really want girl <br> My heart stops pumping blood, when I see you (I see you, when I see you) <br> But I try to play it cool because (I like you, I really like you) <br> [Hook - Tyler, The Creator:] <br> Girl, you're so special <br> To me, to me [x6] <br> [Verse 2 - Tyler, The Creator:] <br> Let's move to California <br> Right now (pack your bags, go pack your bags) <br> I have wings on my back, so we don't (take the plane, have to take the plane) <br> Girl, I know you ready, I can see it in your eyes <br> (Boy, I know you're not, I can tell you're terrified) <br> Nobody has to know and if they did, they wouldn't care <br> (When you rub my hands switching fifth gear) <br> Forget about it baby, let's not waste our afternoon (forget about it baby) <br> Cause we're gonna go fly to the moon (we're gonna go fly to the moon) <br> Yeah, but anyway (Pack your bags, need you pack your bags) <br> Leave your crew, bring your coat, cause it's cold ( leave your crew, bring your coat) <br> [Hook] <br> [Verse 3 - Alice Smith (Leon Ware):] <br> (Don't you wanna go back <br> Let's go, let's go <br> Right now) <br> I think I believe you (Let me show you how girl) <br> It's nice that I need to <br> The earth is so rough I'm not calling your bluff <br> What, what, what (She would love that) <br> I think I believe you <br> Take me higher <br> Let's make our way over  <br>  <br>  <br>  <br> To the Okaga cave <br> Today <br> There we will stay <br> [?] <br> X-Y-Z her <br> Welcome me in <br> Then we'll begin <br> [Verse 4 - Tyler, the Creator:] <br> s**in on my ears <br> Fingers rubbing through your hair <br> Fastwind, slowwind, f** yeah, we behaving bad, uh <br> Probably couldn't tell but I be blushing when you with me <br> When you kiss me, swear to God, blood was rushing to my chimney <br> Laying on my trampoline, looking at the stars <br> From my fake space fog machine <br> Laying on my arm, it's dead <br> From the pressure of your head <br> I said I loved you, said it back <br> Like it was scripted, but you meant it, like the flavor of that lemonade <br> That we was sippin on our sushi-ridden dinner date <br> Oh, you think you special now? <br> Other b**hes trippin' now <br> Cause we're fleeing to the moon <br> f** Earth, man we sick of y'all <br> Wings on my backs and we ain't gotta cop a ticket, nah <br> Nah, nah <br> [Coda - Leon Ware:] <br> Oh yeah <br> Oh yeah, let's go to the moon! <br> Oh yeah, let's go to the moon! <br> Oh yeah, let's go to the moon! (Let's go!) <br> Oh yeah, let's go to the moon! <br> Oh yeah, let's go to the moon! <br> (Watch this) Let's go to the moon! <br> (Favorite director) <br> (Gonna be good) <br> Come on, baby <br> What you wanna do? <br> I'll be okay <br> (I really like you) <br> Take me away <br> f** what they say <br> To another place <br> Another day <br> We in outer space <br> We'll waste our days <br> Sade, Sade, Sade <br> Oh, right now <br> Yes! <br> Let's go to the moon (Yes!) <br> (It's about to start)"
OKRA,"[Intro] <br> Ayo, did this sh** in one take <br> Ayo <br> [Verse 1] <br> Check my bankroll, ayo 400K for vehicle <br> Paintjob look like ashy ankles on Django <br> Interior look mango, shotgun grape, he look like mayo <br> Golden voice on payroll, neck all gold like Kayo Corp <br> We aim at dorks, get out the way, yo, keep them bucks in banks like yayo <br> Swampy n***as out the bayou, pockets flooded y'all be dilute <br> Watered down, I'm Big Mac, I'm quarter pound, you chicken nugget <br> f** it, travel bag Balenciaga, 30,000 just for luggage <br> Financial advisor buggin', Flower Boy is buzzin' <br> Grammy-nominated, tell yo cousin ain't nobody f**in' with him <br> [Chorus] <br> Man, now they go <br> I cut off some friends, where they go <br> I stick to the plan, that's the goal <br> f** these n***as man, that's for sure <br> [Verse 2] <br> Uno the shoe, red with the blue, look like a flag what the f** it do <br> Golf be the set, no more OF, like Ron Artest b**h we aim for your neck <br> Give a f** about you or your respect, yeah that way <br> f** your accolades but I made the cut like I pack a blade <br> You could call me brush, I've been makin' waves <br> Since Ashley Banks' cousin had a fade but that's '92, I'm '91 <br> Watts Riot in my blood, n***a what's up, and that p**y pink like the drink in my cup ha <br> Lemonade, yeah it's Minute Maid, I been gettin' paid pockets gainin' weight  <br>  <br>  <br>  <br> Your bank statements on Mary Kate, but that's up to you <br> [Chorus] <br> Man, now they go <br> I cut off some friends, where they go <br> I stick to the plan, that's the goal <br> f** these (ayo) n***as man, that's for sure <br> [Verse 3] <br> Tell Tim Chalamet to come get at me <br> Skin glowin', clear of acne, diamonds see-through, so holographic <br> Red Ones look like Aidan Mackey, spent dinero like Taxi Driver <br> Handmade is that thing with tires but I rode my bike <br> And vill tail behind me and he got the canon like he bagged Mariah <br> Yeah, we straight but if you wrinkle up the situation he will go grab the iron <br> And he do what I says like Simon, and my b**h mixed like jambalaya <br> Man f** with the fam, we in Japan <br> b**h you’re a bum, see you don't understand <br> Yeah, I cut off some friends T, where you been? <br> b**h I'm in Bel-Air, been lookin' for land <br> Need a spot in the hills, not the beach, need a pool <br> Just to cool it, I do need the gra**, not the sand <br> Got enough rocks, see check my hand <br> And I got crack, watch how I talk <br> And it's still Wolf Gang, b**h watch how I bark <br> Wallace still trippin' on sh** that I bought <br> But, I really do not care the cost 'cause okra <br> [Outro] <br> Man, now they go <br> I cut off some friends"
Open That Coca-Cola,"{Intro} <br> Sip sip sip sip sip sip sip sip sip <br> {Hook x3} <br> Good good good <br> {Hook x2} <br> Good good good <br> {Verse 1} <br> Tell me how it taste <br> Yeah the good good good <br> I'm a little down <br> With the good good good <br> Tell me how it taste <br> Yeah the good good good <br> {Hook x3} <br> Good good good <br> {Verse 2} <br> Tell me how it taste <br> You can tell me how it taste <br> Care to tell me how it taste  <br>  <br>  <br>  <br> You can tell me how it taste <br> You can tell me how it taste <br> You can tell me how it taste <br> You can tell me how it taste <br> {Bridge} <br> 1, 2, 3, yeah (now watch me) <br> 1. 2. 3, yeah (move, move, move, move) <br> 1. 2. 3, yeah (move, move, move, move) <br> 1. 2. 3, yeah (move, move, move, move) <br> 1. 2. 3, yeah (move, move, move, move) "
Parade,"Odd (I'm not yet a man) <br> Future (I'm a little boy) <br> Wolf (Yes I'm over-joyed) <br> Gang (Let's parade in gold) <br> Welcome to the euphoria of c**aine without able <br> I can make music that makes sense, but not meant to be stable <br> Eighteen with the whole world in front of me <br> Odd Future teenagers, nobody can f** with we <br> Odd (I'm not yet a man) <br> Future (I'm a little boy) <br> Wolf (Yes I'm over-joyed) <br> Gang (Let's parade in gold) <br> I scream and jump around on couches while you sit and talk <br> I skip to places, smilin' faces, while you f**in' walk <br> My TV stays on Cartoon Network, f** that Twilight sh** <br> You have highlights about your life, I have half of my high life b**h <br> Go to college, get a job, marry, have a kid <br> Watch them grow and then you die? No, n***a f** the system  <br>  <br>  <br>  <br> Odd (I'm not yet a man) <br> Future (I'm a little boy) <br> Wolf (Yes I'm over-joyed) <br> Gang (Let's parade in gold) <br> Good kids make bad grown ups <br> Stay gold, stray old, maturin' means that your life s**s <br> In my wolf suit, I roam where the wild things at <br> Still growin', still learnin', not knowin' that I'm Matt <br> I don't wanna grow up, I know that sh** for a fact, n***a eighteen <br> Odd (I'm not yet a man) <br> Future (I'm a little boy) <br> Wolf (Yes I'm over-joyed) <br> Gang (Let's parade in gold) <br> They say I'm immature, I say that they depressed <br> I talk to unicorns, I'm wearin' a uniform <br> Of a n***a that don't give a f** about time <br> You live your life all serious while I'm enjoyin' mine"
