Song Title,Lyrics
Foreward,"How many cars can I buy till I run out of drive? <br> How much drive can I have, until I run out of road? <br> How much road can they pave, until I run out of land? <br> How much land can it be until I run in the ocean? <br> n***as go with the motions and all the plans <br> See, I was never into the beaches and all the sands <br> See, I was in the woods with flowers, rainbows and posies <br> Falling out of my pocket, but ya'll want to know if I swam to cool down <br> How much cooler can I get until run out of fans? <br> How many fans can I have till they turn on the AC? <br> If the AC blow up, then I'm TNT, I'm gone <br> I'm gone and I'm finished <br> And I ain't seen my friends in a minute <br> Guess that nothing lasts forever <br> No, nothing lasts forever <br> Nothing sticks together <br> Sick of sitting in doubt <br> Please let me figure this out <br> Shoutout to the girls that I lead on <br> For occasional head and always keeping my bed warm <br> And trying they hardest to keep my head on straight <br> And keeping me up enough 'til I had thought I was airborne <br> How many raps can I write 'til I get me a chain? <br> How many chains can I wear 'til I'm considered a slave?  <br>  <br>  <br>  <br> How many slaves can it be 'til Nat Turner arrives? <br> How many riots can it be 'til them Black Lives Matter? <br> When n***as click, clack, splatter, pew, pew that n***a <br> Life a game of basketball, you better shoot that n***a <br> Cause if that cop got tricky, he better pull <br> Cause when I get pulled over, I usually play it cool <br> Cause I know what I'm driving is usually paid in full <br> And my ego and possessions, will not let me be one <br> Be-cause I got a mansion, my mansion got some rooms <br> And rooms got some windows and my windows got some views <br> And views get some stairs and my backyard does too <br> And if you walk to the bottom, you'll probably see a pool <br> You better not drown, keep them ten toes up <br> Cause if those ten toes down, that mean that you f**ed up <br> And that's what I swim in <br> And if I drown and don't come back? <br> Who's gonna know? (Baby, then I'll know) <br> And if I crash and don't come back? <br> Who's gonna know? (Baby, then I'll know) <br> And if I fall and don't come back? <br> Who's gonna know? (Baby, then I'll know) <br> I'm wondering if I don't come back <br> Baby, then I'll know <br> Don't come back, no no"
Foreword,"–Verse 1: Tyler, The Creator– <br> How many cars can I buy till I run out of drive? <br> How much drive can I have, until I run out of road? <br> How much road can they pave, until I run out of land? <br> How much land can it be until I run in the ocean? <br> n***as go with the motion and all the plans <br> See I was never into the beaches and all the sand <br> See I was in the woods with flowers, rainbows and posies <br> Falling out of my pocket, but ya'll want to know if I swam to cool down <br> How much cooler can I get until run out of fans? <br> How many fans can I have till they turn on the AC? <br> If the AC blow up, then I am TNT <br> I'm gone <br> –Bridge: Rex Orange County– <br> I'm gone and I'm finished <br> And, I ain't seen my friends in a minute <br> Guess that nothing lasts forever <br> No, nothing lasts forever <br> Nothing sticks together <br> Sick of sitting in doubt <br> Please let me figure this out <br> –Verse 2: Tyler, The Creator– <br> Shoutout to the girls that I lead on for occasional head and always keeping my bed warm <br> And trying their hardest to keep my head on straight <br> And keeping me up enough till I had thought I was airborne <br> How many raps can I write till I get me a chain? <br> How many chains can I wear till I'm considered a slave?  <br>  <br>  <br>  <br> How many slaves can it be till Nat Turner arrives? <br> How many riots can it be till them Black Lives Matter? <br> When n***as click, clack, splatter, pew, pew that n***a <br> Life a game of basketball, you better shoot that n***a <br> Cause if that cop got tricky, he better pull <br> Cause when I get pulled over, I usually play it cool <br> Cause I know what I'm driving is usually paid in full <br> And my ego and possessions, will not let me be one be <br> Cause I got a mansion, my mansion got some rooms <br> And rooms got some windows <br> And my windows got some views <br> And views get some stares <br> And my backyard does too <br> And if you walk to the bottom <br> You'll probably see a pool <br> You better not drown <br> Keep them ten toes up <br> Cause if those ten toes down <br> That mean that you f**ed up <br> And that's what I swim in <br> –Outro: Rex Orange County– <br> And if I drown and don't come back? <br> Who's gonna know? (Baby, then I'll know) <br> And if I crash and don't come back? <br> Who's gonna know? (Baby, then I'll know) <br> And if I fall and don't come back? <br> Who's gonna know? (Baby, then I'll know) <br> I'm wondering if I don't come back <br> Baby, then I'll know"
French!,"Got all the black b**hes mad cause my main b**h vanilla <br> She tryna get her groove back like Stella, grab the umbrella <br> When it comes to your perception of my sh**, I'm Helen Keller <br> When it comes to the perfection of my sh**, I know you smell the <br> Rectum, I'm like a chromosome I always X 'em <br> Like Wolverine steps on attackin' a deadly weapon <br> I'm openin' a church to sell coke and Led Zeppelin <br> And f** Mary in her a**.. ha-ha.. yo <br> I'm f**in' Goldilocks up in the forest <br> In the three bear house eatin' their muthaf**in' porridge <br> I tell her it's my house, give her a tour <br> In my basement, and keep that b**h locked up in my storage <br> Rape her and record it, then edit it with more sh** <br> Octop**y special effect erect b**hes we bangin' <br> And please never disrespect my set with Canons <br> Hangin' from our necks like it's a muthaf**in' circus <br> You little n***as better check my French <br> You gettin' money better check my French <br> Ahh, what time is it, huh? Check my French <br> If you got my sh** you better check my French <br> I make it move check my French <br> I speak English but check my French <br> Your ho be on my penis she check my French, b**h <br> I guess I left my dignity up in the cupboard, cause every girl I'm diggin' <br> When I'm diggin' in her p**y, I'm never usin' a rubber <br> But f** it I guess I gotta stretch it out like it was flubber <br> And leave it drippin' green and red like double cheese buggers <br> Chewin' on cum like bubble gum from Hubba <br> This b**h knew dick like Bubba knew shrimp, yeah <br> Yo, I'm seventeen, already sniffin' blow <br> I tell my friends it's asthma every time I start to itch my throat <br> I got a new show for MTV, ""Pimp My Boat""  <br>  <br>  <br>  <br> Because some b**h said my semen was dirty, that's silly ho <br> The most that they can do is find me, I'm hiding <br> Somewhere where Chris Stokes can't find me <br> Oh no, Mister Stokes, I don't like misters, no <br> Don't tell R. Kelly where my little sister go <br> You little n***as better check my French <br> You gettin' money better check my French <br> Ahh, what time is it, huh? Check my French <br> If you got my sh** you better check my French <br> I make it move check my French <br> I speak English but check my French <br> Your ho be on my penis she check my French, b**h <br> Yo, you little n***as better check my French <br> I got all stars and you can check my bench <br> Left Brain, Super 3, Creator Ace <br> Put expressions in their music and create the face <br> Of the picture punchline figured out, ahh I get you <br> No you don't n***a so why don't you go figure <br> You seem confused anyway, pressured enough? <br> You the type of dude that choke when the pressure is up <br> The pressure is the pump and the pressure is us <br> b**hes havin' eargasms and the pleasure is us <br> n***as wanna be O.F. and write letters to us <br> Competition's competition, yo you better than us? <br> Digest what I'm sayin'? I don't think so <br> We sick sh**, throw it up down in the sink, yo <br> The Odd n***as are beginnin' to spill these pink hoes <br> We think sorta odd so we think so <br> Crusin' in my go kart at Walmart sellin' cupcakes <br> Go 'head admit it f*ggot, this sh** is tighter then bu*t rape <br> That involve Ballpark franks and silver duct tape <br> p**nos and hormones and boxes of DiGiorno <br> You h*mos is loco you're probably drinkin' Cuervo <br> With some vatos with the door closed watchin' Zorro, you h*mos.. O.F"
FUCKING YOUNG / PERFECT,"[fu*kING YOUNG] <br> The day that I met you girl <br> I knew that it was something special <br> But I couldn't put my finger on it (f** I can't sing whatever look) <br> We met through mutual friends <br> And this is where the story and confusion begin <br> Cause I was in a problem but I had to pretend that I wasn't <br> [Pre-Chorus:] <br> There go the police man knocking at my door <br> Do I leave out the back and grab my wallet and coat <br> Or do I answer real confused like ""I don't know"" <br> Now me and she held hands and we danced, nothing more <br> She kissed my hand a couple times, FaceTime when we're bored <br> There's nobody at the door, man I'm so paranoid <br> [Chorus:] <br> Girl you're perfect, but you're too f**ing young for me <br> And when temptation calls, I never pick up <br> And girl, you stole my heart but you're too f**ing young <br> This is more than a crush, I just might be in love <br> A six year difference <br> Is a ten year sentence <br> And with the pigment on my skin, I don't want to be another statistic <br> You bring me joy, joy, joy, joy <br> And you fill a void that was once missing <br> And I can say I'm in love <br> [Pre-Chorus] <br> [Chorus] <br> When you're 35, I'll be 41 <br> And when I'm 27, you'll be 21 <br> Yo, this is dumb <br> And when that time comes for that 1-8, I'll probably run <br> Cause I'm f**ing terrified, yo this is dumb <br> You should find someone else <br> I'm not the one for you, sh**, I'm still growing up by myself <br> And mentally you're older than me and that sh** doesn't help <br> Cause if they see you with T, they'll think T needs some help <br> So when you mention ""hang,"" I'm thinking about a tree and a belt <br> And I don't want no relation, sh** no relation <br> Ship when my dick is longer than my intentions- <br> Span, it's gonna s** your sh**  <br>  <br>  <br>  <br> It's that kitchen fan <br> It splattered on me like my dick in my hand <br> What? I'm still f**ing off, not good at ducking off <br> Because I found a goose that I like, but I'm still running off <br> She gon' want a nest, that's why I cannot get f**ing caught <br> That's a scary word, you could save that sh** for the birds <br> But I found my wings, f** <br> (But you're too f**ing young) <br> I really like you <br> (And when temptation calls, I never pick up <br> And girl, you stole my heart but you're too f**ing young) <br> Funny thing about this is <br> By the time you hear this, I'll be in the clear <br> It's T and Uncle Charlie <br> (But you're too young, but you're too young, but you're too young) <br> [PERFECT] <br> [Kali Uchis:] <br> Boy I know that we could be more than just friends <br> But you're scared <br> Boy I know <br> We could be more than just friends <br> But you're scared <br> I know <br> I know that there could be <br> Somethin' for you and me <br> What's your philosophy? <br> You're scared, scared <br> And I exit and wait a while <br> (Just say the word) <br> See the answers are all there <br> (But I'm just too gone to see) <br> You and I are cut from different fiber <br> (I wonder why, I wonder why girl) <br> Don't be too material to see <br> (But I'm just too gone to see) <br> This world is such a struggle just to be <br> f** em all baby it's just you and me <br> [Tyler:] <br> But you're too f**in' young <br> And girl I know that you're the one for me <br> f** <br> Cause you're too f**in young <br> And girl I know that you're the one for me <br> And it hurts <br> It f**in hurts <br> Cause you're too f**in young <br> And girl I know that you're the one <br> That you're the one <br> For me <br> Cause you're too f**in young <br> And girl I know that you're the one for me <br> Yeah <br> (I rock) <br> (I rock) <br> (I rock)"
Garbage,"[Verse 1] <br> Hello, I'm a salesman sorta giant <br> I sell molly and mary and other various items <br> One time one guy came to where I'm residing <br> And I didn't invite him, so instead tried to fight him <br> I got violent, long story short he's not breathing <br> For some reason I liked it and it was really exciting <br> Couldn't stop the addiction, and the irony is <br> A couple junkies went missing and I know right where they're hiding <br> [Hook] <br> Dope in the bag, pretty b**h on the side <br> I sell dope in the back, if you tryna get high <br> Dope in the bag, Pretty b**h on the side <br> I sell dope in the back, if you tryna die <br> [Verse 2] <br> Task force poured into my fortress <br> Found some lipstick, a couple corpses <br> b**hes was harmed and they couldn't reach the alarm <br> I'm ripping sockets out like I had f**ing problems with arms <br> They found a couple portraits on the porch <br> But they don't check up under the floor  <br>  <br>  <br>  <br> It's bodies and hotties and we was raging I'm gauging a shotty <br> Hit so many b**hes I was pimping like Scotty <br> I'm a bull, red, piss me off <br> Like that lipstick position when she kissed me <br> So I bit 'em off, they was too soft, I'm a Wolf <br> And a designer mixing skin cotton leather and wool <br> And most people like flying kites, riding bikes in the woods <br> Baking cake cause its good, I mean I would if I could <br> But I like playing dress up and mix match <br> Sorry I'mma 'fess up, you aren't getting your kids back <br> [Hook] <br> [Bridge 2x] <br> What's in my trunk? White, girl <br> [Outro] <br> You need a warrant, officer <br> You could say I k** 'em, if my product doesn't <br> Couple basement stairs where I drug them, down <br> It's pretty disgusting, finger crush your face <br> I'll leave you permanently blushing, blood <br> Nosebleed d**, cook you in the oven"
Garden Shed,"–Chorus: Estelle– <br> Don't k** the rose <br> Boy, it could move <br> Love every flower <br> Out the cocoon <br> –Verse 1– <br> You don't have to hide <br> I can smell it in your eyes <br> That there's something more to say <br> Them words <br> (Damn, run it back) <br> [Bridge: Estelle] <br> If I could, if I could <br> If you could <br> Find the words to say <br> (Find the words to say <br> Find the words) <br> Shed <br> –Chorus: Estelle– <br> Don't k** the rose <br> Boy, it could move <br> Love every flower <br> Out the cocoon <br> –Verse 2– <br> Ayo <br> Garden shed, garden shed, garden shed, garden shed <br> For the garden <br> That is what I was hiding <br> That is what love I was I in <br> Ain't no reason to pretend <br> Garden shed, garden shed, garden shed <br> Garden shed for the garcons <br> Them feelings I was guarding  <br>  <br>  <br>  <br> Heavy on my mind <br> All my friends lost <br> They couldn't read the signs <br> I didn't wanna talk and tell em' my location <br> And I didn't wanna walk <br> Truth is, since you kid, I thought it was a phase <br> Thought it would be like the Frank poof, gone <br> But, it's still going on <br> Big fan of the base 10 <br> Polk a dot nose how it goes <br> Had to keep it on the subwoofer <br> A couple bu*terflies when I float <br> I was always like ehhh <br> Barely interested, but I went to my boys like bruh <br> This is a crucial subject matter <br> Sensitive like cooking batter <br> ‘Till the temperature that's rising <br> Stepping on that ladder <br> Tryna grab the rings of Saturn <br> I'm a plant it by the time you hear this <br> Chittin' chatter bout to heat it <br> It will not f**ing matter"
GELATO,"[Intro: Tyler, The Creator + Jaquees] <br> Let's hope they don't take this one down man <br> Ooh, mm, mhmm <br> Yeah <br> OG Parker <br> [Verse: Tyler, The Creator + Jaquees] <br> What's the deal-o? Ain't 'gon lie, I'm feelin' you <br> You got me on tippy toe, So who's Oliv, who's Elio? <br> It's don't matter, negative n***as gon' say, this don't add up <br> But f** they math up, sh**, we subtract 'em <br> Ayo, tell me whats the problem, I just pop models <br> Boy or girls these days, sh**, it don't matter <br> We can f** Sunday cause I don't read Bibles <br> But i'm faithful to this money and these Céline goggles <br> I don't pop bottles, I just cop automobiles full throttle <br> New engine can't follow, get a jet to Lake Como <br> We can try some new gelato, shawty, I'm forreal <br> Like my role model hmm, so let's— <br> Shawty, I listen <br> Unlike like my father, I can give you attention  <br>  <br>  <br>  <br> You won't feel empty like pocket that lint in <br> Pack a few bags i got space in my mansions <br> Plural, hurry with decision <br> Cause I'm looking for a parrot and you looking like pigeon <br> Better that's so raven and get another vision <br> If you wanna be my newest edition like Bivens, woah <br> [Chorus: Jaquees] <br> You need some validation <br> Yeah, yeah, I got a plan 'cause you're more than that <br> No better situation, girl <br> No, no, you all for that, and I 'magine that <br> Feel like you need some validation <br> While I'm grippin', your waist, we move to your place <br> No better situation (come on) <br> Girl, I'll be your escape, come and swing my way <br> You think n***as full of lies <br> [Outro: Tyler The Creator] <br> Yeah yeah, Golf Wang, Golf sh**, shoutout Jaquees <br> Switch it up, picking up my car in hour, this view is beautiful"
Glitter,"–Intro– <br> Da na na na na <br> Da na na na na <br> Da na na na na, my baby <br> You’ve been on my mind <br> (How ya feel?) <br> I’m losing my mind because <br> I hope that we can be more than just friends <br> –Hook– <br> Firework <br> I feel like glitter, and every time you come around <br> I feel like glitter <br> You’re the one that I wanna give my life <br> You’re the one that I need to give my time <br> –Verse 1– <br> Ayo <br> Mirror mirror on the wall, who the brightest of them all? <br> I never been the darkest one, ’cause my self esteem is tall <br> So I never seen eye-to-eye with y’all n***as, ayo <br> Uno peso, never paid attention to what n***as gotta say-o <br> So I keep that buck, I ain’t give no f**, then bill me up so I block ’em like Lego <br> Feelin’ glitter, feelin’ good and great <br> Got the burner got the heat like wait <br> Got the sh**, its all up on that head <br> I use it on myself on the day you dipped <br> Got that 4-5-7 track, 8 for me <br> Babydoll, I hope you agree <br> Because you light my <br> –Hook– <br> Firework <br> I feel like glitter, and every time you come around  <br>  <br>  <br>  <br> I feel like glitter <br> (How you feel?) <br> You’re the one that I wanna give my life <br> (How you feel?) <br> You’re the one that I needed in my life <br> ‘Cause I love having you around (I love) <br> ‘Cause I love having you around <br> –Verse 2– <br> Yeah <br> Look at my face, look at that jaw <br> This is north side and yeah I can’t lie <br> We ain’t workout, we a fat boy <br> Yeah, sumo, gotta limo <br> Pills, can’t see-through, must be a window <br> ‘Cause you in the L <br> ‘Could be a DJ, when I see you my heart beat changes tempo <br> Yeah, simple, that’s what I want but I can’t <br> That’s who you are but I ain’t <br> (?) <br> I’m parkin’ in quicksand, wait- <br> Please don’t save me <br> –Outro– <br> Ooooh <br> (Please don’t save me) <br> How ya feel? <br> How ya feel? <br> How ya feel? <br> How ya feel? <br> How ya feel? <br> Fa la la la la <br> Fa la la la la <br> How ya feel? <br> How ya feel? <br> Scum f** Flower Boy <br> Scum f** Flower Boy <br> [Answering Machine] <br> We didn’t get your message, either because you were not speaking or because of a bad connection <br> –Tyler, the Creator– <br> “f**”"
