Song Title,Lyrics
See You Again,"–Intro: Tyler, The Creator– <br> Okay, okay, okay, okay <br> Okay, okay, oh <br> –Verse 1: Tyler, The Creator– <br> You live in my dream state <br> You look at my fantasy <br> I stay in reality <br> You live in my dream state <br> Any time I count sheep <br> That's the only time we make up, make up <br> You exist behind my eyelids, my eyelids <br> Now I don't wanna wake up, wake up <br> –Chorus: Tyler, The Creator & Kali Uchis– <br> 20/20, 20/20 vision <br> Cupid hit me, cupid hit me with precision <br> I wonder if you look both ways <br> When you cross my mind, I said, I said <br> I'm sick of, sick of, sick of, sick of chasing <br> You're the one that's always running through my daydream, I <br> I can only see your face when I close my eyes <br> Can I get a kiss? <br> And can you make it last forever? <br> I said I'm about to go to war <br> I don't know if I'ma see you again <br> Can I get a kiss? (Can I) <br> And can you make it last forever? (Can you) <br> I said I'm about to go to war (‘Bout to) <br> I don't know if I'ma see you again <br> (Uh, switch it up) <br> –Verse 2: Tyler, The Creator– <br> I said, okay, okay, okay, okidokie, my infatuation <br> Is turning into another form of what you call it? — Love  <br>  <br>  <br>  <br> Oh yeah, oh yeah, oh yeah, oh yeah, I ain't met you <br> I've been looking, stuck here waiting for I <br> Stop the chasing, like an alcoholic <br> You don't understand me, what the f** do you mean? <br> It's them rose to the cheeks, yeah it's them dirt-colored eyes <br> Sugar honey iced tea, bumblebee on the scene <br> Yeah I'd give up my bakery to have a piece of your pie <br> Yugh! <br> –Chorus: Tyler, The Creator & Kali Uchis– <br> 20/20, 20/20 vision <br> Cupid hit me, cupid hit me with precision <br> I wonder if you look both ways <br> When you cross my mind, I said, I said <br> I'm sick of, sick of, sick of, sick of chasing <br> You're the one that's always running through my daydream, I <br> I can only see your face when I close my eyes <br> (So) <br> Can I get a kiss? <br> And can you make it last forever? <br> I said I'm about to go to war <br> I don't know if I'ma see you again <br> Can I get a kiss? (Can I) <br> And can you make it last forever? (Can you) <br> I said I'm about to go to war (‘Bout to) <br> I don't know if I'ma see you again <br> –Outro: Tyler, The Creator– <br> Okay, okay, okay, okay <br> Okay, okay, okay, oh-"
Session,"(I can't read) <br> (I got five on it) <br> (I got five on it too my n***as) <br> (You smokin' n***a?) <br> Nah, I ain't smokin' <br> (n***a come on, just hit the f**in' blunt) <br> Nah, ya'll know I don't smoke man <br> (This n***a never wanna smoke) <br> I'm high off life n***a <br> (We should hotbox it) <br> (Straight-edge a** n***a) <br> I'm good man <br> (f** it, if you ain't gonna f**in' smoke n***a, just, just rap for us n***a) <br> Alright, I can hotbox it <br> Yo, yo, look <br> I'm Tyler, Mr. Green Hat, pro-abortion anti-clean rap <br> f** your blog opinion and your feedback <br> My self-respect I leave that in the lost and found <br> Where the black girls get their weaves back, awesome I achieve that <br> Mini, blasting ""You're a jerk"" in some f**ing yellow skinnies <br> Looking like a f**ing f*ggot, bouncing 'round the house trying to find an easy way to rape Minnie <br> Bet you thirty dollars you find her like Cartman found Kenny, dead <br> I like my girls smart, skinny, kinda Pop Tart when I bite into them red <br> I'm a self-racist, you should tape this, ask Sarah, I'm the rapist <br> I'm a fascist, f** fashion, Gucci belts is for them f*ggots <br> My hat is by Jabbia, and if you got a f**ing problem with the Future <br> You can get a d**h wish just like Atiba <br> f** the biz apparent, Odd Future errant <br> I'm watching the Berrics getting head from someone's parent <br> Blind f**ing hate inside my heart, guaranteed that I'm sharing <br> In the force with the cyclops staring <br> I'm flying on a beaver, you're a disbeliever so don't ask for no motherf**in' ride when you see us <br> Swim right past you, the sh**-list said that I'm nutty such a cashew <br> 'Cause I jack off with dish soap and smell gas fumes <br> Permanent brain damage similar to tattoos <br> The sh**, you can mention me if anybody ask you  <br>  <br>  <br>  <br> k** the jungle, let the cats loose <br> You didn't see me here if someone ask you <br> (That n***a got off) <br> Hodgy Beats <br> Hodgy Beats: <br> I want to feel her in every way <br> Mary Jane keeps me high like every day <br> Bong, vaporizer in the sack now <br> Stuck in my high, afraid of heights, I'm trapped <br> Buy a swisher for a dollar or two blunt wraps <br> Roll it up and ensure that everything's fat <br> She ain't got time to try and relieve ya <br> But she'll get all in your head, sativa <br> Mike G: <br> We grind, these n***as asking for some promo <br> We sit back, observe, stacking hella box logos <br> Square circle jerks starting OF moshpit <br> Preaching to the poets, I'm an OF prophet <br> No less profit, fiened when we drop sh** <br> Convertible coupe, b**hes scream when they tops split <br> It's that crack, give you something to sell <br> Put these b**hes on lock down, something like jail <br> Thought she hot I swear, probably rougher than Hell <br> And she ain't gay, but the only thing she like is f**ing Chanel <br> Light skinned women, all s** everything <br> Think we can fit ten in, bowls packed with everything <br> Everything that we call flight, living life <br> This is everything that we call hype <br> I'm everything that they call nice <br> She in colors and sh**, she off that northern lights, right <br> Intimidated by n***as you can't be <br> I'm a G, and this is something you can't see <br> Top ranked, number one my son <br> And she looking for them trees, baby we got some <br> And stay focused on the women and you get less done <br> It's ironic 'cause I always hear you talking about one <br> Them other n***as smoke, they ain't this high <br> How high? n***a, higher than the kites they fly <br> You're high as f**, damn"
Seven,"I'd tell him to eat a dick quicker than Mexicans sprint over borders <br> I give a f** like a quarter with 20 cent <br> At Hamptons with Fred Hampton relaxin' at Happy Camper <br> It's the f**in' financial aid at Hamptons wasn't relaxin', I'm taxin' <br> ""f** 'em all!"" I'm chantin', don't complain I'm just rantin' <br> f** ranking, I'm the best, I'm the champion's chariot <br> I'm a liar like Carrey in ""Liar, Liar"" <br> I'm dirtier than the sheets in the Marriott, Cable guy like Larry <br> Peter Pan in my youth, f**ing fairies <br> I'm using my tooth bait to get that b**hes teeth paste <br> f** it, Odd Future some nazis, black nazis don't copy <br> We perfect, you sloppy, huddled and slightly tacky <br> f**ing lame on my jacket, screw you like a ratchet <br> Screw you like a black teen on Judge Hatchett <br> Endotherms and jaguars, drug dealers and crackers <br> Able students and slackers <br> I'm backwards like Jermaine Dupri in '93 <br> Escaping from concentration camps with a f**ing girl born in a ramp <br> That I ordered from CCS with some diamonds that's VVS <br> Like I went to Sierra Leone in a homecoming dress <br> With some matching pink panties, lipstick from my granny <br> Sup on my hat like that motherf**er Frannie <br> White, red-headed b**h reminded me of Annie <br> She dyno like my state of mind, so yeah she understand me <br> f** you bunches here, never disrespect my family <br> That's for my little brother, sister, cousin and my auntie <br> Wasted f**in' youth? All you old n***as antiques <br> We go skate, rape s*uts and eat donuts from Randy <br> b**hes like Tia Landry watching Billy and Mandy  <br>  <br>  <br>  <br> Motherf**ers wanna be Odd but you can't be <br> Sit the f** down all you old n***as stand me, f*ggot <br> I guess I gotta be a f**in' hand-me-down rapper <br> From Los Angee area anytime I'm f**in' landing <br> f** 2DopeBoyz and NahRight, shout out to Hype Track <br> Them motherf**ers could never get rid of me <br> Guess I gotta do a f**ing song with Dom Kennedy <br> Get these f**in' hip hop bloggers to start feelin' me <br> Because I'm seventeen, compose my own beats <br> Lyrically I'm dope enough to a**-f** the dude who made nicotine <br> Maybe I should buy some Hundreds, wear some f**in' skinny jeans <br> And follow in your footsteps like a motherf**in' millipede <br> Centipede, make songs about Gucci and cigaweed <br> Jerk with my friends like it's some motherf**in' little league <br> No I ain't no f**ing hipster, mister <br> No I'm not no f**ing Kid Cudi, all my f**ing fans love me <br> Collaboration hits for fans screaming f** buddies, yo, yo <br> I'm drivin' in a stolen truck, and I'm probably f**in' drunk <br> Wasted as f**, can't walk it out, DJ Unk <br> My nose is filled with coke and my license is revoked <br> (Shut the f** up!) Who the f** told me not to spoke? <br> f** everybody here, everybody vanish, I'll manage <br> Hop off my dick and make a f**ing sandwitch <br> Everybody listening can s** my dick in Spanish <br> f** you, f*ggot (f**in' ba*tard) <br> Yeah, um, as you can probably tell from listening to this record <br> I was, I was probably angry, probably on my period <br> But um, I didn't mean to offend anyone, alright, I'm lying, OF"
She,"(Verse 1: Frank Ocean) <br> Golden rubbers in these denim pockets (denim pockets) <br> On my waist, there's a black Glock (black Glock) <br> New girl moved on the block (on the block) <br> She been plottin' on my brown co*k (brown co*k) <br> Last night I slept over hers (over hers) <br> During s**, I overheard (I overheard) <br> A sword sliced the air, I pulled out the na-na <br> Rolled off the bed then shot back, pa-pa <br> Blood on the sheets probably spillin' from my gash <br> Looked out the gla**, seen you sprintin' on the gra** <br> A real ninja with the blade and the mask <br> Got them gold ninja stars and red Supreme nunchuks <br> Now she tryna patch me up, but <br> Girl, I was just tryna get a nutbust <br> If that's your ex, you should probably own a pistol <br> But I'm guessin' it's wiser to exit with dude <br> (Hook: Frank Ocean) <br> The blinds wide open so he can <br> See you in the dark when you're sleepin' <br> Think about it, fresh out the shower <br> You touch yourself after hours <br> Ain't no man allowed in your bedroom <br> You're sleeping alone in your bed <br> But check your window, he's at your window <br> (Verse 2: Tyler, The Creator) <br> The night light hits off, turnin' kisses to bites <br> I'm a down to earth n***a with intentions that's right <br> You'll be down in earth quicker if you diss me tonight <br> But I'll be the happiest if you decide to kick it tonight <br> We can chill and I can act like I don't wanna f** <br> You can tell me all your problems like I really give one  <br>  <br>  <br>  <br> But I give two for us cause you're the one that I want <br> Don't wanna seem like a punk p**y that sips on the punk p**y <br> See when I'm with my friends I just put on a front <br> But in the back of my top I'm writing songs about we <br> We as including I and yourself, making three <br> Little ones (?) pretty hard if you ask me <br> You're a pretty broad in the top three <br> Of things that I've been waiting to come, so <br> Meet me by the lake around 10 and skinny dippin' and then <br> We can begin the pretend game, I wanna be Finn from Adventure in Time <br> (Hook) <br> (Bridge: Tyler, The Creator) <br> One, two, you're the girl that I want <br> Three, four, five, six, seven, sh** <br> Eight is the bullets if you say no after all this <br> And I just couldn't take it, you're so motherf**in' gorgeous <br> Gorgeous, baby you're gorgeous <br> I just wanna drag you're lifeless body to the forest <br> And fornicate with it but that's because I'm in love with <br> You... c*nt <br> (Bridge 2: Tyler, The Creator) <br> I just wanna talk, and conversate <br> Cause I usually just stalk you and masturbate <br> And I finally got the courage to ask you on a date <br> So just say yes, let the future fall into place <br> I just wanna talk, and conversate <br> Cause I usually just stalk you and masturbate <br> And I finally got the courage to ask you on a date <br> So just say yes, let the future fall into place... c*nt <br> (Hook) <br> (Bridge)"
SIR BAUDELAIRE,"[Intro: Tyler, the Creator & DJ Drama] <br> The sun beamin' <br> Y'all ready? <br> Ayo (DJ the fu*k-It's DJ the fu*k—) <br> It's T, baby <br> I don't think you're ready <br> Wolf Haley, Bunnyhop, yo <br> I must say, I'm glad you found your way here <br> Yo <br> [Verse: Tyler, the Creator & DJ Drama] <br> Cookie crumbs in the Rolls (Rolls), jet-fuel-scented vest (Vyoom) <br> Swim trunks in the trunk, Geneva water the best (The best, yeah) <br> The passport lookin' thick, the afro need a pick <br> My skin soak up the sun, ain't shakin' hands with you bums (Nah) <br> Bunny Hoppa, the new car doors, they lift open (Woo) <br> The lake water, dry off at the French Open (Ayy) <br> I rub it in these ni**as' faces likе thick lotion <br> That big B is in motion, uh (Gangsta Grillz) <br> Coral peach cobbler, dude, spit likе a llama do <br> Used to be reckless, you should see what them commas do <br> New le FLEUR* season, summertime look like private school  <br>  <br>  <br>  <br> Keep it low, don't want that sh*t to blow like Osama shoe <br> I'm a true connoisseur, hotel concierge <br> Know me as that spaced-out ni**a with the chunky ears <br> UFC, that sh*t swole up, that's VVS, keep Vic safe <br> That's a mansion on that USB, it's T <br> [Outro: Tyler, the Creator & DJ Drama] <br> Yeah <br> I hope you ni**as been spendin' your time wisely <br> Call me if you get lost, baby <br> As you can tell, we have (Haha) <br> This sh*t for the sunseekers <br> Got the bikes on the tarmac <br> Welcome to the disco <br> Hittin' wheelies and sh*t <br> Call me if you get lost <br> Perfume on the skin, ha <br> Hahaha <br> Call me if you lost <br> See, while y'all was in the house (Call me if you lost) <br> We was takin' Rolls Royces to go see alligators <br> DJ Drama, man (Call me if you lost) <br> Travelin' the world <br> Passport stamped up (Call me) <br> It's Tyler Baudelaire, ni**a"
Slater,"Me and Slater just hit a curb, <br> Bunny hop, zoning out, listening to N.E.R.D, <br> Made a couple thousands turds spitting written verbs, <br> sh**, now I kick it in the 'burbs <br> Me? I'm from the slums, n***as who pushing tons <br> Tons of d**, Foul flow dirty mouth like kissing bums <br> Momma done made her one, a witty son <br> With no respect for women so-so, show me your titties hun <br> ""You eighteen?"", Me? I'm twenty something <br> Okay I'm twenty, but I'm soon to be twenty-one <br> I wild out at shows, break sh** it should be fun <br> Venues are like p**y with me, ""Should he cum?"" <br> I'mma wax that like the chapstick in my backpack, for my black lips <br> Then dip to Europe and come back with a stack of cheese <br> A stack of cheese for these rats, Mac and Cheese <br> New Preme sh** got me feeling flyer than a bag of bees <br> f** critics, (How's your dick?), ""sh**, How's your knees?"" <br> Y'all on my dick more than my index when I take a pee <br> Came up with ""Rella"", ain't touch a bag of weed <br> sh** was doper than, Whitney Houston's needs <br> Golf Wang, that's the team to be, ""Aye!"", getting TU, OF NB <br> We was missing Sweatshirt like, where's the hooded sleeve <br> Okay, nevermind, we found him <br> Me and Slater just hit a curb, <br> Bunny hop, zoning out, listening to N.E.R.D, <br> Made a couple thousands turds spitting written verbs, <br> sh**, now I kick it in the 'burbs <br> Guess I win, checks started cashing in, <br> I stopped rapping and started asking ""Where my f**ing pa**ion is?"", <br> Probably where that f*ggot went (Who?), Tyler talking father problems, <br> Shocky sh** he spit to popping topics in a gossip column,  <br>  <br>  <br>  <br> I ain't ask for this, I did it out of boredom, <br> Thought that roach was cool, he died and pushed me into stardom, <br> Now Ye's PJ sippin leche, Chips Ahoy! boy, listening to Cowboy, <br> Aye boy, land in Melbourne and skate to Fitzroy (Aye!), <br> AUS was AWES, I enjoyed, boy, y'all n***as played as a tot's toy, <br> Have a good day as I annoy, oi. <br> Me and Slater just hit a curb, <br> Bunny hop, zoning out, listening to N.E.R.D, <br> Made a couple thousands turds spitting written verbs, <br> sh**, now I kick it in the 'burbs <br> Cameras with panorama's views <br> My shoes have seen more vans than Mexicanas with crackers in Alabama <br> G-O-to the-L-F, this O-F, I open a store so I don't stress <br> But n***a I, (What?), mosh in gardens, jazz punk sh** <br> Playing chords, making up sh**, pardon my Dolly Parton's <br> And I keep sharting, hoodies with rectangles and different colors <br> n******gs think I started kindergarten <br> My b**h was on my handle bars <br> (I just wanna ride my bike) <br> Slater, Slater, Slater, Slater <br> My b**h was on my handle bars <br> Hair blowing in the wind <br> Her freckles look like candy bars <br> Hair blowing in the wind <br> My b**h was on my handle bars <br> (I just wanna ride my bike) <br> Slater, Slater, Slater, Slater <br> My b**h was on my handle bars <br> Hair blowing in the wind <br> Her freckles look like candy bars <br> My cool summer never ends <br> Slater, Slater, Slater, Slater <br> Oh my god.. I guess you're a cool guy <br> You're talking to a f**ing bike, loser <br> (haha) <br> Oh... f**."
Slow It Down,"We come through throbbin' like thunder storms <br> Make them feets get wet and funky up in they under arms <br> I'm too explosive for your ears like I'm throwin' bombs <br> With the exclusive on the channel, b**h I know it's on <br> n***as get mad like cheerleaders, they throw they pom-poms <br> s** a dick, eat salam gettin' they nails done in salons <br> Hodgy Beats is like limp balm <br> If you talk sh**, I'll make you cry and tell your big moms <br> I got nice hands, n***as eat out my big palms <br> Haters must be starvin' nowadays I make California Vietnam <br> And I'm goin' to embalm my creativity <br> Into a CD-rom, so you can feel this sh** up on <br> Turn it up, where's the ba**? <br> Bring the keys, yeah <br> Turn it up, where's the ba**? <br> Bring the keys, oh my God <br> Turn it up n***a, where's the ba**? <br> Could you bring the keys? Yeah <br> Turn it up, n***a where's the ba**? <br> Drop the drums <br> =Pink chinchilla, cause I'm like Thrilla <br> My t-shirts are bathin', a bathin' gorilla <br> You n***as all hype like you drink a cup of Splenda <br> But I ate that whole plate like a fat b**h dinner  <br>  <br>  <br>  <br> I'm never the winner, always the loser <br> I don't choose to win, but I will choose her <br> Her kitty-cat fish loves his tuna <br> I never use a fork I always spoon her <br> Go nuts, instrumental flow much <br> European model white b**h is eatin' donuts <br> f** you f*ggots, I'm with a fat b**h <br> Makin' sh** come like I'm go-go gadget <br> I'm mental, it's instrumental <br> Make your future therapist ask for dental records <br> And I hope this record have you stabbin' n***as with colored pencils <br> Turn it up, where's the ba**? <br> Bring the keys, yeah <br> Turn it up, where's the ba**? <br> Bring the keys, oh my God <br> Turn it up n***a, where's the ba**? <br> Could you bring the keys? Yeah <br> Turn it up, n***a where's the ba**? <br> Drop the drums <br> Yo, bubble gum that Reese's Pieces <br> You're feelin' life, I'll mug your teachers <br> I've got m**ms crawlin' on Jesus <br> I f**ed Kelly, where is Regis? <br> Found Alicia, now she keyless <br> Cold as ice, and now I'm creamless <br> Murdered every bod from my squad <br> So technically, now I'm teamless, O.F. is so prestigious"
SMUCKERS,"[Hook:] <br> For your boy <br> I'm watchin' Freaks and Geeks with the trampoline on the floor <br> I'm tryna pop the McLaren with the vertical doors n***a <br> [Verse 1 - Tyler, The Creator:] <br> Money, money, money, money, money ain't the motive <br> What's your name again? Nobody knows it <br> Don't speak to me n***a, you not important <br> I'm focused <br> They say I'm nutty, picnic basket <br> Not short of a sandwich <br> A peanut bu*ter, Boyce Watkin's a f*ggot <br> Please come and get me <br> Said I s** him at your neck <br> Like a hickey, boy I'm sicky <br> Like a HIV victim , man nobody f**in' with me <br> I got banned from New Zealand, whitey called me demon <br> And a terrorist, God dammit I couldn't believe it <br> Ban a kid from the country, I never fall, never timber <br> But you f**ed up as a parent, your child idol's a n******g <br> I clearly don't give a f**, say you could run that sh** back <br> And f** your loud pack, and f** your Snapchat <br> Cherry Bomb, the greatest f**in' album since the days of sound <br> And that sh** gon' pop just like that n***a that was never 'round <br> Damn, bout to drop, gas em up, thick exhaust <br> Young T, came quick, hard to beat, dick is soft <br> We ain't lyin', we the truth, call him Simba, beats his hooves <br> Tyler the Creator sweatin' Jesus juice <br> Put that f**in' cow on my level, cause I'm raisin' the stakes <br> Mom I made you a promise, it's no more section 8 <br> When we ate its the steaks, now our section is great <br> Cause that's the level I'm at, my n***as pa** em a plate <br> Ye! <br> [Break - Kanye West:] <br> Why, why, why? <br> Why don't they like me? <br> Cause Nike gave lot of n***as checks <br> But I'm the only n***a ever to check Nike <br> [Verse 2 - Kanye West:] <br> Richer than white people with black kids <br> Scarier than black people with ideas <br> Nobody can tell me where I'm headin' <br> But I feel like Michael Jordan, Scottie Pippen at my wedding <br> They say I'm crazy but that's the best thing going for me <br> You can't Lynch Marshawn, and Tom Brady throwin' to me <br> I made a million mistakes, but I'm successful in spite of em <br> I believe you like a fat trainer takin' a bite or somethin' <br> I wanna turn the tanks to playgrounds <br> I dream't of 2Pac, he asked me ""are you still down?"" <br> ""Yeah my n***a"", Its on, its on, its on, its on <br> I know they told their white daughters don't bring home Jerome <br> I am the free n***a archetype <br> I am the light and the beacon, you can ask the deacon <br> It's funny when you get extra money <br> Every joke you tell just be extra funny <br> I mean you can even dress extra bummy <br> Cocaine, bathroom break, nose extra runny <br> And I gave you all I got, you still want extra from me <br> Oxford want a full blown lecture from me <br> And the Lexus pull up, skrrtt like hop, I'd hopped out, wa**up <br> Erg erg erg, step back, hold up, my leg'll be stuck <br> I studied the proportions, emotions runnin' out of Autobahn  <br>  <br>  <br>  <br> Speed level, had a drink with fear, and I was textin' God <br> He said ""I gave you a big dick, so go extra hard"" <br> [Hook 2:] <br> For your boy <br> I'm tryna pop the McLaren with the vertical doors <br> I'm watchin' Freaks and Geeks got a trampoline in my room <br> Damn <br> [Bridge:] <br> Two, Three, Four <br> Hold your f**in' horses <br> n***as really f**in' thought that T lost it <br> Like I bet it at an auction been exhausted <br> I been workin' while y'all cylinders smoke like broken exhaust tips <br> f**in' losers <br> [Lil Wayne:] <br> Hold your f**in' ponies my homie <br> I whip your donkey by my lonely I eat p**y like Shoney's <br> That's Tunechi, homie, master of ceremonies <br> I knock 'em down, domino effect, no pepperoni <br> I swear <br> [Verse 3 - Tyler the Creator:] <br> This them golf boys, like them hot boys <br> For the nine, 9 and 2,000, but its the 2,000 <br> When the one four and the one five, yo what up Wayne <br> (What up Slime, n***a go hard) <br> Yeah, I'mma go hard like before Cain <br> Got too much drive, need like ten lanes <br> Life is a broad and she give brain <br> That's that road head, that's a dream car <br> Got a four ten, of that same year I was born <br> That's that one nine nine one, 'nother n***a like I <br> You won't find one, cuz n***a I'm a god, a divine one, Tune <br> [Verse 4 - Lil Wayne:] <br> My trigger finger wise but my nine dumb <br> Middle finger blind so its f** A-N-Y one <br> f**, skate and die son, a hundred ways to die son <br> I'm starin' at a tramp on lean, make my eye jump <br> Use Adderall like alarm clocks wake my high up <br> Steaks are high well done and prime cut, eat up <br> I stick my rollie in her mouth, let the time come <br> She got hair like Shanaynay, and eyes like Wonda <br> Oh my goodness <br> [Verse 5 - Tyler, the Creator:] <br> Wayne them b**hes ugly, these n***as colder than Tommy buddy <br> Ye we hittin' models like Tony Parker be hittin' bottles <br> b**h I'm goin' harder than yellow cabby stoppin' for Lionel <br> (Black a** n***a) <br> They be duckin' us n***as, shout out to Donald Sterling <br> Boy lets get a scrimmage, I'll cut some n***as, I'll bring the Clippers <br> And a couple owners, that's kinda German <br> You bring the nooses, and a couple trees <br> Where the money grow, and (get) bodies burning <br> Cuz I'm tryna hang like I'm Mr. Cooper or Jews in Berlin <br> Or some n***as from Alabama, Birmingham <br> I need music all over the street like Erick Sermon <br> Was, f** us, maybe we should team up <br> Anti Golf boys cuz I don't f** with me either <br> I'mma liar, I'mma f*ggot <br> [Verse 6 - Lil Wayne:] <br> Son you need Jesus <br> But I heard he left sunset, to go on tour with Yeezus, well <br> I'm prayin' for the new Yeezys <br> And you pussies prayin' that we squash the beef like zucchinis <br> I know, it ain't gain, nor fame, nor tame <br> Or lame, nor strange <br> [Outro - Tyler, The Creator:] <br> Nah f*ggot its Golf Wang"
